file_name,transcription,p_scores
024270127.WAV,W IY W ER T AO K IH NG AH B AW T S AH K AH,2.0 2.0 2.0 2.0 2.0 2.0 2.0 2.0 2.0 2.0 2.0 2.0 1.8 2.0 2.0 2.0 2.0
024270155.WAV,B AE K AE N D AE T JH AH S T DH AH R AY T T AY M,2.0 2.0 2.0 2.0 2.0 1.8 2.0 2.0 2.0 1.6 2.0 2.0 1.2 1.2 2.0 2.0 2.0 2.0 2.0 1.4
024270168.WAV,W AH T D UH Y UW TH IH NG K DH OW Z AA R,2.0 1.8 2.0 2.0 1.8 2.0 1.8 2.0 2.0 2.0 2.0 2.0 2.0 1.8 2.0 2.0
024270176.WAV,S T IH L W EY T IH NG F AO IH T T UW HH AE P AH N,2.0 2.0 2.0 2.0 2.0 2.0 2.0 2.0 2.0 2.0 2.0 2.0 1.8 2.0 2.0 2.0 2.0 2.0 2.0 2.0
024270178.WAV,L UH K S T UW B IY W ER TH DH AH W EY T,2.0 0.0 2.0 2.0 2.0 1.8 2.0 2.0 2.0 2.0 2.0 2.0 2.0 2.0 2.0 2.0
024270183.WAV,F IY L Z S OW G UH D T UW B IY B AE K T AH G EH DH ER,2.0 2.0 2.0 1.8 2.0 2.0 2.0 2.0 2.0 2.0 2.0 2.0 2.0 2.0 2.0 2.0 2.0 2.0 2.0 2.0 2.0 2.0
024270197.WAV,L IH S N T UW IH T IH N AO L IH T S G L AO R IY,2.0 2.0 2.0 2.0 2.0 2.0 2.0 1.8 2.0 2.0 2.0 2.0 2.0 2.0 2.0 2.0 2.0 2.0 2.0 2.0
024270206.WAV,M AA S K S AA R P AA R T AH V Y UW N IH F AO M,2.0 2.0 2.0 2.0 2.0 2.0 2.0 2.0 2.0 2.0 2.0 2.0 1.8 2.0 2.0 2.0 2.0 2.0 2.0 1.4
024270245.WAV,W EH N IH Z IH T T AY M T UW T AO K AH B AW T G AH N Z,2.0 2.0 2.0 2.0 2.0 2.0 2.0 2.0 2.0 2.0 2.0 2.0 2.0 2.0 2.0 2.0 2.0 2.0 1.8 2.0 1.8 1.6 1.8
024270270.WAV,DH IH S IH Z N AH T AH N AY S S T AO R IY IH T S T R UW,2.0 2.0 2.0 2.0 2.0 2.0 2.0 2.0 2.0 2.0 2.0 2.0 2.0 2.0 2.0 2.0 2.0 2.0 2.0 2.0 2.0 2.0 2.0
024270292.WAV,W IY SH UH D T OW T AH L IY G OW F AO AH W AO K,2.0 2.0 2.0 2.0 2.0 2.0 2.0 2.0 1.6 2.0 2.0 2.0 2.0 2.0 2.0 2.0 2.0 2.0 2.0
024270313.WAV,B AH T DH EY M AH S T D UH IH T,2.0 2.0 1.8 2.0 2.0 2.0 2.0 2.0 2.0 2.0 1.8 2.0 1.8
024270336.WAV,AE N D N AW IH T S M AY T ER N,2.0 2.0 1.8 2.0 2.0 2.0 2.0 2.0 2.0 2.0 2.0 2.0 1.8
024300001.WAV,DH EH R M EY B IY AH W EY T UW CH EY N JH AO L DH AE T,2.0 2.0 2.0 2.0 2.0 2.0 2.0 2.0 2.0 2.0 2.0 1.6 2.0 2.0 2.0 2.0 2.0 2.0 2.0 2.0 2.0
024300052.WAV,N AW HH IY Z OW P AH N HH IY K AE N S EH L IH T T UW Y UW,2.0 2.0 2.0 2.0 1.8 2.0 2.0 1.6 2.0 2.0 1.8 2.0 2.0 2.0 2.0 2.0 2.0 2.0 2.0 2.0 2.0 2.0 2.0
024300061.WAV,IH T W AH Z AH N Y UW M AA R K IH T,2.0 2.0 2.0 2.0 1.8 2.0 2.0 2.0 2.0 2.0 2.0 2.0 2.0 2.0 1.6
024300063.WAV,K UH D Y UW P UH T HH IH M AH N DH AH B AO R D,2.0 2.0 2.0 2.0 1.8 2.0 2.0 1.8 2.0 2.0 2.0 2.0 2.0 2.0 2.0 2.0 2.0 2.0 1.8
024300065.WAV,HH IY W AH Z N AH T S AH P OW R T IH D B AY DH AH P AA R T IY DH EH R,2.0 2.0 2.0 2.0 1.8 2.0 2.0 2.0 2.0 2.0 2.0 2.0 2.0 2.0 2.0 2.0 2.0 2.0 2.0 2.0 2.0 2.0 1.6 2.0 0.8 2.0 2.0 2.0
024300068.WAV,S OW DH EY HH AE V T UW G OW W IH DH M AO S AH F IH S T IH K EY T P AH Z IH SH AH N IH NG,2.0 1.8 2.0 2.0 2.0 2.0 2.0 2.0 2.0 2.0 2.0 2.0 2.0 2.0 2.0 2.0 2.0 2.0 2.0 2.0 1.8 1.8 2.0 2.0 2.0 2.0 2.0 2.0 0.6 2.0 2.0 2.0 2.0 2.0 2.0
024300080.WAV,B AH T IH Z N AH T N AW,2.0 2.0 2.0 2.0 1.8 2.0 2.0 2.0 2.0 2.0
024300082.WAV,N AW B IH K AH Z AH V D R AE G AH N Z L UH K W EH R HH IY IH Z T AH D EY,2.0 2.0 2.0 2.0 2.0 2.0 2.0 2.0 2.0 2.0 2.0 1.6 2.0 2.0 2.0 1.8 2.0 2.0 2.0 2.0 2.0 2.0 2.0 2.0 2.0 1.8 2.0 2.0 2.0 2.0
024300093.WAV,DH EH R IH Z AO L W EY Z DH AH K W EH S CH AH N AH V W AH T W IH L F AH L OW,2.0 2.0 2.0 2.0 2.0 2.0 2.0 2.0 2.0 2.0 2.0 2.0 2.0 2.0 2.0 2.0 2.0 2.0 2.0 1.8 2.0 2.0 2.0 2.0 2.0 2.0 2.0 2.0 1.6 2.0 2.0
024300099.WAV,DH IY IH K AH N AH M IY IH Z F AA R F R AH M S AW N D,2.0 2.0 2.0 1.6 0.8 1.6 0.8 1.6 1.6 2.0 1.8 2.0 2.0 2.0 2.0 2.0 1.8 2.0 2.0 2.0 1.8 2.0
024300118.WAV,K IY P IH N T AH CH HH AE V AH G R EY T W IY K EH N D,2.0 2.0 2.0 2.0 2.0 2.0 2.0 2.0 2.0 2.0 2.0 2.0 2.0 2.0 2.0 2.0 2.0 2.0 2.0 2.0 2.0 1.8
024300131.WAV,AY M IY N IH T W AH Z DH AH L AA S T S AH P ER,2.0 2.0 2.0 2.0 2.0 2.0 2.0 2.0 2.0 2.0 2.0 2.0 2.0 2.0 2.0 2.0 0.4 2.0 2.0
024300132.WAV,W EH L TH AE NG K S F AO DH AH K AH N S IH D AH R EY SH N,2.0 2.0 2.0 2.0 2.0 2.0 2.0 2.0 2.0 2.0 2.0 2.0 2.0 2.0 2.0 2.0 1.2 2.0 2.0 2.0 2.0 2.0 2.0
024300135.WAV,HH IY AO L W EY Z N OW Z HH AW T UW M EY K M IY F IY L B EH T ER,2.0 2.0 2.0 2.0 2.0 2.0 1.8 2.0 2.0 1.8 2.0 2.0 2.0 2.0 2.0 2.0 2.0 2.0 1.8 2.0 2.0 2.0 2.0 2.0 2.0 2.0
024300189.WAV,IH T S W EH N Z D EY Y UW N OW DH AH D R IH L,2.0 2.0 2.0 2.0 1.2 2.0 1.8 2.0 2.0 2.0 2.0 1.4 2.0 2.0 2.0 1.8 1.8 1.8 2.0
024300221.WAV,IH N AH F AH V DH AH T AY M L UW P,2.0 2.0 2.0 2.0 2.0 2.0 2.0 2.0 2.0 2.0 2.0 2.0 1.8 2.0
024300270.WAV,IH T IH Z S AH CH AH G UH D F ER M,2.0 2.0 2.0 1.8 2.0 2.0 2.0 2.0 2.0 2.0 2.0 2.0 2.0 2.0
024300330.WAV,AE T F ER S T HH IY K UH D N AH T S P IY K,2.0 2.0 2.0 2.0 2.0 2.0 2.0 2.0 2.0 2.0 2.0 2.0 2.0 2.0 2.0 2.0 2.0 2.0
024300345.WAV,AE N D N AW AY G OW D AW N T UW L UH K AE T IH T,2.0 2.0 2.0 2.0 2.0 2.0 2.0 2.0 2.0 2.0 2.0 2.0 2.0 2.0 2.0 2.0 2.0 2.0 2.0 2.0
024300360.WAV,SH IY W AH Z B R AO D AE T DH IH S SH AH UW L D AH Z,2.0 1.8 2.0 1.8 2.0 2.0 2.0 2.0 2.0 2.0 2.0 2.0 1.6 1.6 2.0 0.8 1.2 2.0 2.0 2.0 1.8
024380040.WAV,DH EH R Z T UW M AH CH AH S T EY K T UW D UH AH DH AH W AY Z,2.0 2.0 2.0 2.0 2.0 2.0 2.0 2.0 2.0 2.0 2.0 2.0 2.0 2.0 2.0 1.8 2.0 1.8 2.0 2.0 2.0 2.0 2.0 1.8
024380041.WAV,IH T S HH AE P AH N D T UW M IY B IH F AO,2.0 2.0 2.0 2.0 2.0 2.0 2.0 2.0 1.8 2.0 1.8 2.0 2.0 2.0 2.0 2.0 2.0
024380116.WAV,P L IY Z L EH T M IY N OW HH AW AY K AE N B IY AH V S ER V IH S,2.0 2.0 2.0 1.8 2.0 2.0 2.0 2.0 1.8 2.0 2.0 2.0 2.0 2.0 2.0 2.0 2.0 2.0 1.8 2.0 1.8 2.0 2.0 1.6 0.4 1.6
024380142.WAV,P AE R AH D AY S M EY B IY AH R AW N D DH AH K AO R N ER,2.0 2.0 2.0 2.0 2.0 2.0 2.0 2.0 2.0 2.0 2.0 2.0 2.0 2.0 2.0 2.0 1.8 2.0 2.0 1.8 2.0 2.0 2.0
024380154.WAV,K AO L M IY IH F Y UW D UH,2.0 2.0 2.0 2.0 2.0 2.0 1.8 2.0 1.8 2.0 1.8
024380194.WAV,R OW L AH P T UW DH AH P AA R T IY L AY K,2.0 2.0 2.0 2.0 2.0 2.0 2.0 2.0 2.0 2.0 2.0 2.0 2.0 2.0 2.0 2.0 2.0
024380197.WAV,Y UW S T T UW B IY AH N OW L D S K UW L AY TH IH NG K,2.0 2.0 2.0 2.0 2.0 2.0 2.0 2.0 2.0 2.0 2.0 2.0 2.0 2.0 2.0 2.0 1.6 2.0 2.0 2.0 2.0 2.0
024380200.WAV,AY N IY D T UW K IY P AH P W IH TH TH IH NG Z B EH T ER,2.0 2.0 2.0 2.0 2.0 1.8 2.0 2.0 2.0 2.0 2.0 2.0 2.0 1.8 2.0 2.0 2.0 1.8 2.0 2.0 2.0 2.0
024380204.WAV,SH IY W AH Z DH EH R F AO AH K AA N S ER T,2.0 2.0 2.0 2.0 1.8 1.6 1.6 1.6 2.0 2.0 1.6 2.0 2.0 2.0 2.0 2.0 2.0
024380234.WAV,T EY K EH V R IY S T EH P AH V DH AH W EY,2.0 2.0 2.0 2.0 2.0 2.0 2.0 2.0 2.0 2.0 2.0 1.8 1.8 2.0 2.0 2.0 2.0
024380247.WAV,AE T DH AH K AH S T AH V W AH T,2.0 1.6 2.0 2.0 2.0 2.0 2.0 2.0 2.0 2.0 2.0 1.0 2.0
024380265.WAV,DH AE T S AH B AH K IH T L IH S T G OW L,2.0 2.0 2.0 2.0 2.0 2.0 2.0 2.0 1.8 2.0 2.0 2.0 2.0 2.0 2.0 2.0 2.0
024380276.WAV,S OW G IH V M IY S AH M TH IH NG T UW B IH L IY V,2.0 2.0 2.0 2.0 1.8 2.0 1.8 2.0 2.0 2.0 2.0 2.0 2.0 2.0 2.0 2.0 1.6 2.0 2.0 1.8
024380278.WAV,HH AE P IY B ER TH D EY TH AE NG K Y UW F AO Y UH AH AO L Y UW D UH,2.0 2.0 2.0 2.0 2.0 2.0 2.0 2.0 2.0 2.0 2.0 2.0 2.0 2.0 1.8 2.0 2.0 2.0 1.8 1.8 2.0 2.0 2.0 1.8 2.0 1.8
024380315.WAV,IH T W AH Z T AY T F IH T,2.0 2.0 2.0 2.0 1.8 2.0 2.0 2.0 2.0 1.8 2.0
024380317.WAV,AE N D DH EH N B AY HH IH Z G R EY V HH IH Z AY Z OW P AH N,1.8 2.0 1.8 2.0 2.0 2.0 2.0 2.0 2.0 2.0 1.8 2.0 2.0 2.0 1.8 2.0 2.0 1.8 2.0 1.8 2.0 1.2 2.0 2.0
024380325.WAV,DH EH N Y UW M AH S T M EY K S UW P AW T AH V DH AH S N EY K S,2.0 2.0 2.0 2.0 2.0 2.0 2.0 2.0 2.0 2.0 2.0 2.0 2.0 1.6 2.0 2.0 2.0 2.0 1.8 2.0 2.0 2.0 2.0 2.0 2.0 2.0
024380354.WAV,DH AE T S DH AH B EH S T G EY M AO L W EY Z,2.0 2.0 2.0 2.0 2.0 2.0 2.0 2.0 2.0 2.0 2.0 1.8 1.8 2.0 2.0 2.0 2.0 1.6
024380363.WAV,AY W AH Z N AH T L EH F T D R IH F T IH NG,2.0 2.0 2.0 1.8 2.0 2.0 2.0 2.0 1.6 2.0 2.0 2.0 2.0 2.0 2.0 2.0 2.0 2.0
024380369.WAV,HH AE D IH T HH AE P AH N D AH N P ER P AH S,2.0 2.0 2.0 2.0 1.8 1.2 2.0 1.6 2.0 2.0 2.0 2.0 2.0 2.0 2.0 2.0 0.8 2.0
024410049.WAV,AY AH P AH L AH JH AY Z T UW DH AH K AO T,2.0 2.0 2.0 2.0 2.0 2.0 2.0 2.0 2.0 2.0 2.0 2.0 2.0 2.0 2.0 2.0
024410052.WAV,N OW W AH N S IY M Z K W AY T SH UH AH IH Z DH AH P L AE N W IH L W ER K,2.0 2.0 2.0 1.8 2.0 2.0 2.0 2.0 2.0 2.0 2.0 2.0 2.0 2.0 2.0 2.0 2.0 2.0 2.0 2.0 2.0 2.0 2.0 2.0 2.0 2.0 2.0 2.0 2.0 2.0
024410092.WAV,AY TH IH NG K HH IY K AE N L IY D AH S T UW V IH K T ER IY AH G EH N S T EH N IY B AH D IY,2.0 2.0 2.0 2.0 2.0 2.0 2.0 2.0 2.0 2.0 2.0 2.0 2.0 2.0 2.0 2.0 1.8 2.0 2.0 2.0 2.0 1.6 2.0 2.0 2.0 2.0 2.0 2.0 2.0 2.0 2.0 0.8 1.8 2.0 2.0 2.0
024410098.WAV,HH IY IH Z AO L S OW AH M AH NG DH OW Z T R AY IH NG T UW L ER N HH AW,2.0 2.0 2.0 2.0 2.0 2.0 2.0 2.0 2.0 2.0 2.0 2.0 2.0 2.0 1.8 2.0 2.0 2.0 2.0 2.0 2.0 2.0 2.0 2.0 2.0 2.0 2.0
024410110.WAV,HH IY W AH D R IY CH B AE K AE N D G EH T AH L IH T L S AH M TH IH NG EH K S T R AH,2.0 2.0 2.0 1.8 2.0 2.0 1.8 2.0 2.0 2.0 2.0 2.0 2.0 2.0 2.0 2.0 2.0 2.0 2.0 2.0 2.0 2.0 2.0 2.0 2.0 2.0 2.0 2.0 2.0 1.6 2.0 1.6 1.6 2.0
024410149.WAV,W AH T D UH Y UW TH IH NG K AH V M AY S T AE CH UW,2.0 1.8 2.0 2.0 1.8 2.0 1.8 2.0 2.0 2.0 2.0 1.8 2.0 2.0 2.0 2.0 2.0 2.0 2.0 2.0
024410158.WAV,S OW SH L AE N D D AW N T UW ER TH,2.0 2.0 2.0 2.0 2.0 2.0 1.6 2.0 2.0 2.0 2.0 1.8 2.0 2.0
024410160.WAV,F IH N IH SH T R AY Z AH V DH AH L AA S T N AY T,2.0 2.0 2.0 2.0 2.0 2.0 2.0 2.0 1.8 2.0 2.0 2.0 2.0 2.0 2.0 2.0 2.0 2.0 2.0 2.0
024410173.WAV,W AH N D AH W AH T HH IY TH IH NG K S W IY SH UH D D UH W IH DH HH IH M,2.0 1.6 2.0 2.0 2.0 2.0 1.8 2.0 2.0 2.0 2.0 2.0 2.0 2.0 2.0 2.0 2.0 2.0 2.0 2.0 2.0 1.8 2.0 2.0 1.8 2.0 2.0 1.4
024410222.WAV,AO IH T IH Z JH AH S T M IY AE N D HH UW K EH R Z,2.0 2.0 2.0 2.0 2.0 1.0 2.0 2.0 2.0 2.0 1.8 2.0 2.0 2.0 2.0 2.0 2.0 1.2 1.2 1.8
024410228.WAV,AY K AY N D AH V L AY K DH IH S S N OW S T AO M,2.0 2.0 2.0 2.0 2.0 1.8 2.0 2.0 2.0 1.6 2.0 2.0 2.0 2.0 2.0 2.0 2.0 2.0 2.0 1.4
024410240.WAV,S OW M AH CH T UW D UH T AH M AH R OW,2.0 2.0 2.0 2.0 2.0 2.0 1.8 2.0 1.8 2.0 2.0 2.0 2.0 2.0 2.0
024410241.WAV,W AY D UH Y UW W AA N T T UW R IH P L EY S HH IH M,2.0 2.0 2.0 1.8 2.0 2.0 2.0 2.0 2.0 1.8 2.0 1.8 2.0 1.6 2.0 1.6 1.6 2.0 2.0 2.0 2.0
024410294.WAV,IH T S P AA T AH V DH AH S IH AH IY Z,2.0 2.0 2.0 2.0 2.0 2.0 2.0 2.0 1.6 2.0 2.0 2.0 2.0 2.0 1.6
024410312.WAV,K AH L IH JH IH Z AO L AH B AW T S EH T IH NG Y AO S EH L F AH P F AO DH AH F Y UW CH ER,2.0 2.0 2.0 2.0 2.0 2.0 1.8 2.0 2.0 2.0 2.0 2.0 2.0 2.0 2.0 2.0 2.0 2.0 1.6 1.4 2.0 2.0 2.0 1.8 2.0 2.0 2.0 2.0 2.0 2.0 2.0 2.0 2.0 2.0 2.0
024410318.WAV,L EH T HH ER HH AE V HH ER OW N W EY F AO DH AH M OW M AH N T,2.0 2.0 2.0 2.0 2.0 2.0 2.0 2.0 2.0 1.8 1.6 2.0 2.0 2.0 2.0 1.8 2.0 2.0 2.0 2.0 2.0 2.0 2.0 2.0
024410322.WAV,AE N D F AO DH IH S HH IY IH Z P UH T T UW SH EY M,2.0 2.0 2.0 2.0 1.8 2.0 2.0 2.0 2.0 2.0 2.0 2.0 2.0 1.6 2.0 2.0 1.8 2.0 2.0 0.8
024410350.WAV,AE N D AE Z S AH CH Y UW N IY D HH EH L P,2.0 2.0 2.0 2.0 2.0 2.0 2.0 2.0 2.0 2.0 2.0 2.0 2.0 2.0 2.0 2.0 2.0
024410368.WAV,DH AH M OW T IH V F AO DH AH K R AY M IH Z N AH T F AA T UW S IY K,2.0 2.0 2.0 2.0 2.0 2.0 2.0 2.0 1.8 2.0 2.0 2.0 2.0 2.0 2.0 2.0 1.8 2.0 1.2 0.0 2.0 2.0 2.0 1.8 2.0 2.0 2.0
024410377.WAV,W AH T S R AH NG W IH DH Y AO AY Z,2.0 2.0 2.0 2.0 2.0 2.0 2.0 2.0 2.0 1.6 2.0 2.0 2.0 1.6
024480016.WAV,B AH T DH EH R W AH Z N OW IH M IY D IH AH T AH F IH SH L K AH M EH N T,2.0 2.0 2.0 2.0 2.0 2.0 2.0 2.0 1.8 2.0 2.0 2.0 2.0 2.0 2.0 1.4 1.4 2.0 1.8 2.0 2.0 2.0 2.0 2.0 2.0 2.0 2.0 2.0 2.0
024480028.WAV,AY L AH V D HH ER W IH TH AO L M AY HH AA R T,2.0 2.0 2.0 2.0 2.0 2.0 2.0 1.6 1.6 1.8 2.0 2.0 2.0 2.0 2.0 2.0 2.0 2.0
024480094.WAV,W IY HH AE V N OW IH N T R AH S T IH N AH T EH M P T T UW D UH DH AE T,2.0 2.0 2.0 2.0 2.0 2.0 2.0 2.0 2.0 2.0 2.0 2.0 2.0 2.0 2.0 2.0 2.0 2.0 2.0 2.0 2.0 2.0 2.0 1.8 2.0 1.8 2.0 2.0 2.0
024480095.WAV,TH ER Z D EY IH Z DH AH L AA S T D EY AH V DH IH S Y IH AH R S D IH B EY T,1.8 2.0 1.4 2.0 2.0 2.0 1.8 1.8 2.0 2.0 2.0 2.0 1.8 2.0 2.0 2.0 1.8 2.0 2.0 2.0 2.0 2.0 2.0 2.0 2.0 2.0 2.0 2.0 0.4 2.0
024480105.WAV,B AH T IH T M AY T B IY AO L AH B AW T DH AH F IH Z IH K L P L EY,2.0 2.0 2.0 2.0 2.0 2.0 1.6 2.0 2.0 2.0 2.0 2.0 2.0 2.0 2.0 2.0 1.6 2.0 2.0 2.0 1.6 2.0 2.0 2.0 2.0 2.0 2.0
024480127.WAV,W UH D IH T B IY P AH S AH B L F AO AH S T UW D UH AH N IH N T ER V Y UW,2.0 2.0 2.0 2.0 2.0 2.0 2.0 2.0 1.8 2.0 2.0 2.0 2.0 2.0 2.0 2.0 2.0 2.0 1.8 2.0 1.8 2.0 2.0 2.0 2.0 2.0 2.0 2.0 2.0 2.0
024480159.WAV,IH T IH Z AH F AO M AH V S EH L F IH SH N AH S,2.0 2.0 2.0 1.8 2.0 2.0 2.0 2.0 2.0 1.8 2.0 2.0 2.0 2.0 2.0 2.0 2.0 1.2 2.0
024480186.WAV,JH AH S T T UW HH IH AH HH IH Z V OY S,2.0 2.0 2.0 2.0 2.0 1.8 2.0 2.0 2.0 2.0 2.0 1.8 2.0 2.0 2.0
024480188.WAV,HH OW P IH NG DH AE T DH EY AA R D UW IH NG DH AH S EY M W IH DH DH IH S W AH N,2.0 1.6 2.0 2.0 2.0 1.6 2.0 2.0 1.8 2.0 2.0 2.0 2.0 2.0 2.0 2.0 1.6 2.0 2.0 2.0 2.0 2.0 2.0 1.4 1.6 2.0 2.0 2.0 2.0 2.0
024480212.WAV,W AH T AH B AW T DH AH SH EY P AH V DH AH Y UW N IH V ER S,2.0 2.0 2.0 2.0 2.0 2.0 2.0 2.0 2.0 2.0 0.6 2.0 2.0 1.8 1.6 2.0 2.0 2.0 2.0 2.0 2.0 2.0 2.0
024480228.WAV,S OW IH N N IY D AH V AH G UH D M UW V IY,2.0 2.0 2.0 2.0 2.0 2.0 2.0 2.0 1.8 2.0 2.0 2.0 2.0 2.0 2.0 2.0 2.0
024480232.WAV,S AH M T AY M Z DH AH B EH S T TH IH NG Y UW K AE N D UH IH Z N AH TH IH NG,2.0 2.0 2.0 2.0 2.0 2.0 1.6 1.0 1.4 2.0 2.0 2.0 2.0 2.0 2.0 2.0 2.0 2.0 2.0 2.0 2.0 2.0 1.8 2.0 1.8 2.0 2.0 2.0 2.0 2.0
024480241.WAV,HH IY W AH Z T R AY IH NG T UW K IY P Y UW S EY F,2.0 1.8 2.0 2.0 1.8 2.0 2.0 2.0 2.0 2.0 2.0 1.8 2.0 2.0 2.0 2.0 2.0 2.0 0.6 2.0
024480244.WAV,L ER N DH AH W AY N AH T JH AH S T DH AH W AH T,2.0 2.0 2.0 2.0 2.0 2.0 2.0 2.0 2.0 2.0 2.0 2.0 2.0 2.0 2.0 2.0 2.0 1.8 2.0
024480251.WAV,IH T S N AY S T UW HH AE V AH B R EY K,2.0 2.0 2.0 2.0 2.0 2.0 2.0 1.8 2.0 2.0 2.0 2.0 2.0 2.0 2.0 2.0
024480255.WAV,DH EH N IH T S T AY M T UW D UH S AH M TH IH NG N Y UW,2.0 2.0 2.0 2.0 2.0 2.0 2.0 2.0 2.0 2.0 1.8 2.0 1.8 2.0 2.0 2.0 2.0 2.0 2.0 2.0 2.0 2.0
024480270.WAV,HH AE D AH N AY S D EY AE T DH AH Z UW,2.0 2.0 2.0 2.0 2.0 2.0 2.0 2.0 2.0 2.0 2.0 2.0 2.0 2.0 2.0
024480292.WAV,L ER N T UW B IY K AH M F AH T AH B L W IH DH DH AH P R EH SH AH,2.0 2.0 2.0 2.0 1.8 2.0 1.8 2.0 2.0 1.6 2.0 2.0 2.0 2.0 2.0 2.0 2.0 2.0 1.6 2.0 2.0 2.0 2.0 2.0 2.0 2.0
024480297.WAV,AY B IH L IY V IH N Y UW Y UW K AE N M EY K IH T HH AE P AH N,2.0 2.0 2.0 2.0 2.0 2.0 2.0 2.0 2.0 1.8 2.0 2.0 2.0 2.0 2.0 2.0 2.0 2.0 2.0 2.0 2.0 2.0 1.6 2.0 2.0
024480335.WAV,AA R Y UW K AH M IH NG T UW B EH D,2.0 2.0 2.0 2.0 2.0 2.0 2.0 2.0 2.0 2.0 1.8 2.0 2.0 1.6
024500006.WAV,TH R IY AE N D F AO R AA R DH AH B EH S T,1.8 2.0 2.0 2.0 2.0 1.8 2.0 2.0 2.0 2.0 2.0 2.0 2.0 2.0 2.0 2.0 2.0
024500021.WAV,HH IY AE N D HH IH Z P EH ER AH N T S S EY DH EY AA R N OW L AH NG G AH S P IY K IH NG,2.0 2.0 2.0 2.0 2.0 2.0 2.0 1.8 2.0 2.0 2.0 2.0 2.0 2.0 2.0 2.0 2.0 2.0 1.8 2.0 2.0 2.0 2.0 2.0 1.8 2.0 2.0 2.0 2.0 2.0 2.0 2.0 2.0 2.0
024500033.WAV,IH N AH F AH V DH AH T EH K N IH K L S T AH F,2.0 2.0 2.0 2.0 2.0 2.0 2.0 2.0 2.0 2.0 2.0 2.0 2.0 2.0 2.0 2.0 2.0 2.0 2.0
024500095.WAV,W IY AO L N OW DH IH S IH Z AH T AH F R EY S T R AE K,2.0 2.0 1.8 2.0 2.0 2.0 2.0 2.0 2.0 2.0 2.0 2.0 2.0 1.6 2.0 2.0 2.0 1.8 2.0 2.0 2.0 2.0
024500126.WAV,Y UW M AH S T HH AE V AH L AH T,2.0 1.8 2.0 2.0 2.0 1.8 2.0 2.0 2.0 2.0 2.0 2.0 1.8
024500139.WAV,B AH T AY N OW W AH T Y UW AA R,2.0 2.0 2.0 2.0 2.0 2.0 2.0 2.0 2.0 2.0 2.0 2.0 2.0
024500141.WAV,DH IH S W UH D B IY AH V EH R IY B IH Z IY D EY,1.8 2.0 2.0 2.0 2.0 2.0 2.0 2.0 2.0 2.0 2.0 2.0 2.0 2.0 2.0 2.0 2.0 2.0 2.0
024500147.WAV,AY K AH M F R AH M AH F AE M AH L IY AH V T IY CH ER S,2.0 2.0 2.0 2.0 2.0 2.0 2.0 1.8 2.0 2.0 2.0 2.0 2.0 2.0 2.0 2.0 2.0 2.0 2.0 2.0 1.8 2.0
024500151.WAV,S AH R IY F AO B IY IH NG AH P L AE S T IH K,2.0 2.0 2.0 2.0 2.0 2.0 2.0 2.0 2.0 2.0 2.0 2.0 2.0 2.0 2.0 2.0 2.0 2.0
024500156.WAV,W AH T D UH Y UW S EY DH AH M OW S T,2.0 2.0 1.8 2.0 1.8 2.0 1.8 2.0 1.2 2.0 2.0 2.0 2.0 2.0 2.0
024500164.WAV,W AH T AE N D HH AW D UH Y UW S IH NG,2.0 2.0 2.0 2.0 2.0 1.8 2.0 2.0 2.0 1.8 2.0 1.8 2.0 2.0 1.8
024500228.WAV,W EH R AA Y UW G OW IH NG T UW B IY R EH D IY T UW P L EY,2.0 2.0 2.0 2.0 2.0 1.8 2.0 2.0 2.0 2.0 2.0 1.8 2.0 2.0 2.0 2.0 2.0 2.0 2.0 1.8 2.0 2.0 2.0
024500250.WAV,D UH Y UW L AY K DH AH K AH L ER AH V DH AH S K AY,2.0 1.8 2.0 1.8 2.0 2.0 2.0 2.0 2.0 2.0 2.0 2.0 2.0 2.0 2.0 2.0 2.0 2.0 2.0 2.0
024500268.WAV,W AY IH N DH AH W ER L D EY EH M AY N AH T IH N DH AH B EH D,2.0 2.0 2.0 2.0 2.0 2.0 2.0 2.0 1.4 2.0 0.8 2.0 2.0 2.0 2.0 2.0 2.0 2.0 2.0 2.0 2.0 2.0 2.0 2.0
024500284.WAV,IH T S S AH N D EY N AY T N AH T DH AH EH N D AH V DH AH W ER L D,2.0 2.0 2.0 2.0 1.8 1.8 2.0 2.0 2.0 2.0 2.0 2.0 1.6 2.0 2.0 1.6 1.8 2.0 2.0 2.0 2.0 2.0 2.0 2.0 2.0 1.4 2.0
024500317.WAV,AE N D IH N AH S EH N S Y UW W ER R AY T,2.0 2.0 1.8 2.0 2.0 2.0 2.0 2.0 2.0 2.0 2.0 1.8 2.0 2.0 2.0 2.0 2.0
024500327.WAV,AE N D IH T S M AY OW N HH AE N D,2.0 2.0 2.0 2.0 1.6 2.0 2.0 2.0 0.6 1.6 2.0 2.0 2.0 0.8
024500333.WAV,AE Z F AO R DH AH F AY N L TH R IY,1.2 1.8 2.0 2.0 2.0 2.0 2.0 2.0 1.8 2.0 2.0 1.8 2.0 2.0
024500350.WAV,HH IY S T EH ER D AE T DH AH S T Y UH D N T S,2.0 2.0 2.0 2.0 0.2 0.2 2.0 2.0 2.0 2.0 2.0 2.0 2.0 2.0 2.0 2.0 2.0 1.8 1.8
024500363.WAV,DH EH R Z N AH TH IH NG T UW D UW B AH T G EH T D R AH NG K,2.0 2.0 2.0 1.6 2.0 2.0 1.8 2.0 2.0 2.0 1.8 2.0 2.0 2.0 2.0 2.0 2.0 2.0 2.0 2.0 2.0 1.2 2.0 2.0
024510017.WAV,IH T W AH Z T AH F F AO AH S AE T DH AH T AY M,2.0 2.0 2.0 2.0 1.8 2.0 2.0 2.0 2.0 1.8 2.0 2.0 2.0 2.0 2.0 2.0 2.0 2.0 1.6
024510043.WAV,IH T S V EH R IY M AH CH P AA T AH V M AY IH N T IH M AH T L AY F,2.0 2.0 2.0 2.0 2.0 2.0 2.0 2.0 2.0 2.0 2.0 2.0 2.0 2.0 2.0 2.0 2.0 2.0 2.0 2.0 2.0 2.0 1.2 2.0 2.0 2.0 2.0
024510061.WAV,IH T S T UW P R EH SH AH S T UW AH S T UW L EH T IH T D AY,2.0 2.0 2.0 2.0 2.0 2.0 2.0 0.4 2.0 2.0 2.0 2.0 2.0 2.0 2.0 2.0 1.8 2.0 2.0 2.0 2.0 1.8 2.0 2.0
024510070.WAV,IH T S AO L P AA T AE N D P AA S L AH V N Y UW M AE N IH JH M AH N T S T AY L,2.0 2.0 2.0 2.0 2.0 2.0 2.0 2.0 2.0 2.0 2.0 2.0 2.0 2.0 2.0 2.0 2.0 2.0 2.0 2.0 2.0 2.0 2.0 2.0 2.0 2.0 2.0 2.0 2.0 2.0 2.0 2.0 2.0
024510114.WAV,T R UW P S M UW V IH N T UW B R EY K AH P S AH M S T R AY K S,2.0 2.0 2.0 2.0 2.0 2.0 2.0 2.0 2.0 2.0 2.0 1.8 2.0 2.0 2.0 2.0 2.0 2.0 2.0 2.0 1.2 2.0 2.0 2.0 2.0 2.0 2.0
024510164.WAV,W EH R IH N S AW TH AE F R IH K AH AA Y UW F R AH M,2.0 1.6 1.6 2.0 2.0 2.0 2.0 2.0 2.0 2.0 2.0 2.0 2.0 2.0 2.0 2.0 2.0 2.0 2.0 2.0 2.0
024510179.WAV,G AH D AY L AH V DH IH S M AE N AO L R EH D IY,2.0 2.0 2.0 2.0 2.0 1.6 2.0 2.0 2.0 2.0 2.0 2.0 2.0 2.0 1.6 2.0 1.6 2.0 2.0
024510195.WAV,S OW G R EY T F L T UW B IY AH P AA T AH V DH IH S,2.0 2.0 2.0 2.0 2.0 2.0 2.0 2.0 2.0 1.8 2.0 1.8 2.0 2.0 2.0 2.0 2.0 2.0 2.0 2.0 2.0
024510206.WAV,G UH D P IY P L K AH M T UW DH OW Z HH UW W EY T,2.0 2.0 2.0 2.0 2.0 2.0 2.0 2.0 2.0 2.0 2.0 1.8 2.0 2.0 1.8 2.0 2.0 2.0 2.0 2.0
024510215.WAV,JH AH S T K AO T AH G L IH M P S AH V M AY S EH L F IH N DH AH M IH AH AH,2.0 2.0 2.0 1.6 2.0 2.0 2.0 2.0 2.0 2.0 2.0 2.0 2.0 2.0 2.0 2.0 2.0 2.0 2.0 2.0 2.0 2.0 2.0 2.0 2.0 2.0 2.0 1.8 1.8 1.8
024510224.WAV,T UW M EY K AH D IH F R AH N S Y UW M AH S T B IY DH AH D IH F R AH N S,2.0 1.8 2.0 2.0 2.0 2.0 2.0 2.0 2.0 2.0 1.4 1.6 2.0 2.0 1.8 2.0 2.0 2.0 2.0 2.0 1.8 2.0 2.0 2.0 2.0 2.0 2.0 1.4 1.6 2.0
024510247.WAV,B IY DH AH M IH AH AH K L Y UW W AA N T T UW S IY IH N DH AH W ER L D,2.0 0.4 1.6 2.0 2.0 1.6 1.6 2.0 2.0 2.0 2.0 2.0 2.0 2.0 2.0 2.0 2.0 1.8 2.0 2.0 2.0 2.0 2.0 2.0 2.0 2.0 2.0 2.0
024510252.WAV,S AH M W AH N W AA N T T UW G OW T UW W ER K F AO M IY,2.0 2.0 2.0 2.0 2.0 2.0 2.0 2.0 2.0 2.0 2.0 1.8 2.0 2.0 2.0 1.8 2.0 2.0 2.0 2.0 2.0 2.0 2.0
024510275.WAV,AO D UH Y UW W AH N T M IY T UW,2.0 2.0 1.8 2.0 1.8 2.0 2.0 2.0 2.0 2.0 1.8 2.0 1.8
024510316.WAV,W AH N L UH K W IH L B IY S AH F IH SH N T,2.0 2.0 2.0 2.0 1.8 2.0 2.0 2.0 2.0 2.0 2.0 2.0 2.0 2.0 2.0 2.0 2.0 2.0
024510323.WAV,N OW EY N JH L W UH D D UW S AH CH AH TH IH NG,2.0 2.0 2.0 2.0 2.0 2.0 2.0 1.8 2.0 2.0 2.0 2.0 2.0 2.0 2.0 2.0 2.0 2.0
024510336.WAV,HH Y UW M EY N D AA K T ER Z M OW S T AH V DH AH M,2.0 2.0 2.0 2.0 2.0 2.0 2.0 2.0 2.0 2.0 2.0 1.8 2.0 2.0 2.0 1.8 2.0 1.8 2.0 1.8 2.0
024510351.WAV,DH AH P R AH F EH S ER T ER N D D AW N DH AH SH IY T S,1.4 2.0 2.0 2.0 2.0 2.0 2.0 2.0 2.0 2.0 2.0 2.0 2.0 2.0 2.0 2.0 1.8 2.0 2.0 2.0 2.0 2.0
024510352.WAV,DH IH S W AH Z DH AH G ER L HH IY HH AE D HH AE D D AW T S AH V,2.0 2.0 2.0 2.0 2.0 2.0 2.0 2.0 2.0 2.0 2.0 2.0 1.8 2.0 2.0 2.0 2.0 2.0 2.0 2.0 2.0 2.0 2.0 1.8 1.8
024510375.WAV,IH T W AH Z AH S M AO L R UW M,2.0 2.0 2.0 2.0 2.0 2.0 2.0 2.0 2.0 2.0 2.0 2.0 1.8
024880041.WAV,DH EY T AO K AH B AW T DH AH M AW N T AH N S,2.0 2.0 2.0 2.0 2.0 2.0 2.0 2.0 2.0 2.0 2.0 2.0 2.0 2.0 2.0 2.0 2.0 2.0
024880059.WAV,EH V R IY TH IH NG IH Z S T IH L AH HH EH D AH V M IY,2.0 2.0 2.0 2.0 1.6 2.0 2.0 2.0 1.8 2.0 2.0 2.0 1.8 2.0 2.0 2.0 2.0 2.0 1.8 2.0 2.0
024880070.WAV,HH IY W AH Z AE T DH AH HH AY T AH V HH IH Z P AW ER,2.0 2.0 2.0 2.0 1.8 2.0 2.0 1.6 1.6 2.0 2.0 2.0 2.0 1.8 2.0 2.0 1.8 2.0 2.0 2.0
024880098.WAV,DH EY G EH T Y UW S T T UW DH AH HH IY T,2.0 2.0 2.0 2.0 2.0 2.0 2.0 2.0 1.8 2.0 2.0 2.0 1.6 2.0 2.0 2.0
024880118.WAV,L EH T S M EY K SH UH AH DH IH S IH Z OW N L IY DH AH B IH G IH N IH NG,2.0 2.0 2.0 2.0 2.0 2.0 2.0 2.0 2.0 2.0 2.0 2.0 2.0 2.0 2.0 2.0 2.0 2.0 2.0 2.0 2.0 2.0 2.0 2.0 2.0 2.0 2.0 2.0
024880155.WAV,W UH D L AH V T UW S IY Y UW M EY K IH T AH P HH IH AH,2.0 1.6 1.6 2.0 1.8 2.0 2.0 1.8 2.0 2.0 2.0 1.8 2.0 2.0 2.0 2.0 2.0 2.0 2.0 2.0 2.0 2.0
024880176.WAV,B IH K AO Z IH Z DH AH R AY T TH IH NG T UW D UW,2.0 2.0 2.0 2.0 1.8 2.0 1.8 2.0 1.8 2.0 2.0 1.6 2.0 2.0 2.0 2.0 1.8 2.0 2.0
024880190.WAV,B AH T S T IH L N OW AY D IH AH W AA N T W AH T T UW AA S K,2.0 2.0 1.8 2.0 2.0 2.0 2.0 2.0 2.0 2.0 2.0 2.0 2.0 2.0 2.0 2.0 1.8 2.0 1.8 2.0 2.0 2.0 2.0 2.0 2.0
024880194.WAV,S OW P L IY Z F IY L F R IY T UW L EH T AH S N OW,2.0 1.8 2.0 2.0 2.0 1.8 2.0 2.0 1.8 2.0 2.0 2.0 2.0 2.0 2.0 2.0 2.0 2.0 2.0 2.0 2.0
024880195.WAV,W EH R D UH Y UW TH IH NG K IH Z AH G UH D F IH T,2.0 2.0 2.0 2.0 1.8 2.0 1.8 2.0 2.0 2.0 2.0 2.0 2.0 2.0 2.0 2.0 2.0 2.0 1.4 2.0
024880207.WAV,AY R IH AH L IY N IY D T UW D UH B EH T ER,2.0 2.0 2.0 2.0 2.0 2.0 2.0 2.0 1.8 2.0 2.0 2.0 1.8 2.0 2.0 2.0 2.0
024880210.WAV,HH IY HH AE D T UW G EH T AW T AH V DH AH K EH R K AA R,2.0 2.0 2.0 2.0 2.0 2.0 2.0 2.0 2.0 2.0 2.0 2.0 2.0 1.8 1.8 2.0 2.0 1.4 1.4 2.0 2.0 2.0
024880234.WAV,IH N S T EH D Y UW G IH V M IY S AH N,2.0 2.0 2.0 2.0 2.0 2.0 2.0 2.0 2.0 2.0 2.0 2.0 2.0 2.0 1.4 1.6
024880245.WAV,AY D UH N AH T W AH N T T UW P L EY DH IH S,2.0 2.0 1.8 2.0 2.0 2.0 2.0 2.0 2.0 1.8 2.0 2.0 2.0 2.0 2.0 2.0 2.0 2.0
024880258.WAV,D UH Y UW EH V ER TH IH NG K AH B AW T DH AH TH IH NG Z Y UW S EY,2.0 1.8 2.0 2.0 2.0 2.0 2.0 2.0 2.0 2.0 2.0 2.0 2.0 1.8 2.0 2.0 2.0 2.0 2.0 2.0 1.8 2.0 2.0 2.0 2.0
024880267.WAV,TH AE NG K Y UW F AO R DH AH P OW S T,2.0 2.0 2.0 2.0 2.0 2.0 2.0 1.8 1.8 1.4 1.4 2.0 0.4 2.0 2.0
024880269.WAV,W EH L AO L T AY M T UW K AO L IH T AH N AY T,2.0 1.6 1.8 2.0 2.0 2.0 2.0 2.0 2.0 2.0 2.0 2.0 1.8 2.0 2.0 2.0 2.0 2.0 2.0
024880299.WAV,DH IH S P R AH B AH B L IY G OW IH NG T UW B IY DH AH B EH S T M UW V IY EH V ER,1.8 2.0 2.0 2.0 2.0 2.0 1.6 1.6 2.0 2.0 2.0 2.0 2.0 2.0 2.0 2.0 2.0 2.0 1.8 1.8 2.0 2.0 2.0 2.0 2.0 2.0 2.0 2.0 2.0 2.0 2.0 2.0
024880303.WAV,AE N D IH T M IY N Z DH AH W ER L D T UW M IY,2.0 2.0 2.0 2.0 2.0 2.0 2.0 2.0 1.8 2.0 2.0 2.0 2.0 1.6 1.8 2.0 1.8 2.0 1.8
024880339.WAV,AY W AH Z T R AY IH NG T UW G EH S DH AH T AY M,2.0 2.0 2.0 1.8 2.0 2.0 2.0 2.0 2.0 2.0 2.0 2.0 2.0 2.0 2.0 2.0 2.0 2.0 2.0
025380004.WAV,DH EH R W AH HH AE T S B AH T N Z AE N D R EH D W AY T AE N D B L UW B AH L UW N Z,1.6 2.0 2.0 2.0 1.6 2.0 2.0 2.0 2.0 2.0 2.0 2.0 2.0 1.8 2.0 2.0 2.0 2.0 2.0 2.0 2.0 2.0 2.0 2.0 2.0 2.0 2.0 2.0 2.0 2.0 1.0 2.0 1.6 2.0 1.6
025380051.WAV,SH IY W IH L F AY T AE N D W IY AA R EH D IY,1.2 2.0 2.0 2.0 2.0 2.0 2.0 2.0 2.0 2.0 2.0 2.0 2.0 2.0 2.0 2.0 2.0 2.0
025380065.WAV,AY W AH N T IH D DH IH S T UW EH N D,2.0 2.0 2.0 2.0 2.0 2.0 1.6 2.0 2.0 2.0 2.0 1.8 1.6 1.8 2.0
025380091.WAV,IH T IH Z AE N IH N AH IH N T ER N AE SH N AH L W ER D,2.0 2.0 2.0 1.8 2.0 2.0 2.0 2.0 2.0 2.0 2.0 2.0 2.0 2.0 0.0 2.0 2.0 2.0 2.0 2.0 2.0 2.0
025380107.WAV,HH IY W AH Z R IH P AO T IH D IH N G AA R D IH D K AH N D IH SH N T AH D EY,2.0 2.0 2.0 2.0 1.8 2.0 2.0 2.0 2.0 2.0 2.0 2.0 2.0 2.0 2.0 2.0 2.0 2.0 2.0 2.0 2.0 1.8 2.0 2.0 2.0 2.0 2.0 2.0 2.0 2.0 2.0
025380133.WAV,AH D V AY S AE Z F AA R AE Z W AH T,0.8 2.0 2.0 2.0 2.0 2.0 1.8 2.0 2.0 2.0 2.0 1.8 2.0 2.0 2.0
025380149.WAV,W ER K IH Z N AH T AO L DH AE T T UW L AY F,2.0 2.0 2.0 2.0 1.8 2.0 2.0 2.0 2.0 2.0 2.0 2.0 2.0 2.0 2.0 2.0 2.0 2.0
025380151.WAV,Y EH S AE N D DH AH D EH D L IY W AH N T UW,2.0 2.0 2.0 2.0 2.0 2.0 1.8 2.0 2.0 1.4 2.0 2.0 2.0 2.0 1.4 2.0 2.0 2.0
025380152.WAV,M IY N W AY L IH Z IH T P IH G R OW S T Y EH T,2.0 2.0 2.0 2.0 2.0 2.0 2.0 2.0 2.0 2.0 2.0 2.0 2.0 2.0 2.0 2.0 2.0 2.0 2.0 2.0
025380158.WAV,P UH T IH NG AO L AH V AH S AE T R IH S K AH V AH N Y UW K L IH AH W AO,2.0 2.0 2.0 2.0 2.0 1.8 1.8 1.4 1.8 2.0 2.0 2.0 2.0 2.0 2.0 2.0 2.0 2.0 1.8 2.0 2.0 2.0 2.0 2.0 2.0 2.0 2.0 2.0 0.0
025380162.WAV,B AH T DH EH R W AH Z N OW P R OW T EH S T,2.0 2.0 2.0 2.0 1.8 1.8 2.0 2.0 1.8 2.0 2.0 2.0 2.0 1.6 2.0 2.0 2.0 2.0
025380175.WAV,EH V R IY B AH D IY IH Z G EH T IH NG R EH D IY F AO DH EH R P IH CH,2.0 1.8 2.0 2.0 2.0 2.0 2.0 2.0 2.0 2.0 2.0 2.0 2.0 2.0 2.0 2.0 2.0 2.0 2.0 2.0 2.0 2.0 2.0 2.0 2.0 2.0 2.0
025380202.WAV,SH OW DH AH P EY R AY S V IH D IY OW,2.0 2.0 2.0 2.0 2.0 2.0 2.0 2.0 2.0 1.8 2.0 2.0 2.0 2.0
025380217.WAV,W EH L DH AE T W AH Z JH AH S T R IH D IH K Y AH L AH S,2.0 2.0 2.0 2.0 2.0 2.0 2.0 2.0 1.8 1.0 2.0 2.0 2.0 2.0 2.0 2.0 2.0 2.0 2.0 2.0 2.0 1.8 2.0
025380251.WAV,AO R DH AH W AH N W IH DH DH AH F AH T AA G R AH F ER S,2.0 2.0 2.0 2.0 2.0 2.0 2.0 2.0 2.0 1.8 2.0 2.0 2.0 0.8 1.6 0.8 2.0 2.0 0.8 2.0 2.0 2.0
025380256.WAV,AY HH AE V N OW AY D IH AH W AY IH T S P AA P Y AH L ER,2.0 2.0 2.0 1.8 2.0 2.0 2.0 2.0 2.0 2.0 2.0 2.0 2.0 1.8 1.8 2.0 1.6 2.0 2.0 1.6 2.0 2.0
025380277.WAV,Y EH S IH T W AH Z AE N ER TH K W EY K,2.0 2.0 2.0 2.0 2.0 2.0 2.0 1.8 2.0 2.0 2.0 2.0 2.0 2.0 1.6 2.0
025380298.WAV,HH OW P Y UW AO L HH AE D AH G UH D W IY K EH N D,2.0 2.0 2.0 2.0 2.0 2.0 2.0 2.0 2.0 2.0 2.0 2.0 2.0 2.0 2.0 2.0 2.0 1.8 2.0 2.0
025380340.WAV,HH IY HH AE D AH M OW M AH N T AH V D AW T,2.0 2.0 2.0 2.0 2.0 2.0 2.0 2.0 2.0 2.0 2.0 2.0 2.0 1.8 2.0 1.8 2.0
