file_name,transcription,p_scores
010640098.WAV,DH AE T S P AA T AH V M AY JH AH B,1.6 2.0 2.0 2.0 2.0 2.0 2.0 2.0 1.8 2.0 2.0 2.0 2.0 1.8
010640166.WAV,K AO F IY IH N DH AH M AO N IH NG IH Z AH B Y UW T IH F L TH IH NG,2.0 2.0 2.0 2.0 2.0 2.0 2.0 2.0 2.0 2.0 2.0 2.0 2.0 2.0 1.8 1.6 2.0 2.0 2.0 2.0 2.0 2.0 2.0 1.6 2.0 2.0
010640210.WAV,Y UW W IH L AO L W EY Z B IY T UW B EH S T F AO M IY,2.0 2.0 2.0 2.0 2.0 2.0 1.6 2.0 2.0 1.6 2.0 2.0 2.0 2.0 2.0 2.0 2.0 2.0 2.0 2.0 2.0 2.0
010640212.WAV,F AO L IH N L AH V W IH DH Y UH AH P ER P AH S,2.0 2.0 2.0 2.0 2.0 2.0 2.0 2.0 2.0 2.0 2.0 2.0 1.8 1.8 1.8 1.8 1.6 1.2 1.8
010640242.WAV,AE N D IH T W AH Z T UW F AH N IY,2.0 2.0 2.0 2.0 2.0 2.0 1.8 1.8 2.0 2.0 2.0 2.0 2.0 2.0
010640250.WAV,M AY T AY M T UW D UH IH N R AY T T AY M,2.0 2.0 2.0 2.0 2.0 2.0 2.0 2.0 1.8 2.0 2.0 1.6 2.0 2.0 2.0 2.0 2.0
010640277.WAV,F AO L IH N L AH V W IH TH N AW Y UW,2.0 2.0 2.0 2.0 2.0 2.0 2.0 2.0 2.0 2.0 1.8 2.0 1.6 2.0 2.0
010640280.WAV,AY TH IH NG K IH T S T AY M W IY HH AE V AO L M OW S T IH N AH N S IY,2.0 1.8 2.0 2.0 2.0 2.0 2.0 2.0 1.2 1.6 2.0 2.0 2.0 2.0 2.0 2.0 1.8 1.6 2.0 2.0 2.0 1.2 2.0 2.0 1.6 2.0 2.0 2.0
010640284.WAV,T AH D EY M AY T B IH T G UH D D EY,2.0 2.0 2.0 2.0 2.0 1.6 2.0 2.0 2.0 2.0 2.0 2.0 2.0 2.0 2.0
010640286.WAV,IH T S G OW IH NG T UW B IY AH W ER D W AH N,2.0 2.0 2.0 2.0 2.0 2.0 2.0 2.0 2.0 2.0 2.0 1.6 2.0 2.0 2.0 2.0 2.0 2.0
010640297.WAV,HH OW P Y UW W IH L L EH T M IY D UH IH T F AO Y UW,2.0 0.8 2.0 2.0 2.0 2.0 2.0 1.6 2.0 2.0 2.0 2.0 1.8 2.0 1.8 1.8 2.0 2.0 2.0 2.0 1.8
010640314.WAV,IH T S Y UW AH K L AH K IH N DH AH AA F T AH N UW N,2.0 2.0 2.0 2.0 1.8 1.6 2.0 2.0 2.0 2.0 2.0 2.0 2.0 1.6 2.0 2.0 2.0 2.0 2.0 1.8 2.0
010640366.WAV,W AY CH AY L D DH EH R W AH Z N OW M AO HH AA M IH N DH AH DH AH N,2.0 2.0 2.0 0.4 0.8 2.0 1.6 1.6 1.6 2.0 2.0 2.0 2.0 2.0 2.0 2.0 2.0 0.8 2.0 2.0 2.0 1.6 2.0 2.0 2.0 1.6
010750002.WAV,D EH V IH D K AE N S IY DH AH K AE T,2.0 2.0 2.0 2.0 2.0 2.0 2.0 2.0 2.0 2.0 2.0 2.0 2.0 2.0 2.0
010750003.WAV,T IH M K AE N D R AO DH AH W EY L,2.0 2.0 2.0 2.0 2.0 2.0 2.0 2.0 1.4 2.0 2.0 2.0 1.4 2.0
010750010.WAV,AY L AY K T AY G ER,2.0 2.0 2.0 2.0 2.0 2.0 2.0 2.0
010750011.WAV,T EH D IH K AE N D R AO DH AH IY G L,1.6 2.0 2.0 2.0 2.0 2.0 2.0 2.0 2.0 1.8 2.0 1.6 2.0 2.0 1.8
010750021.WAV,L UW S IY W IY T UW S IY Z IY B R AH,2.0 2.0 2.0 2.0 2.0 2.0 1.6 1.6 1.6 1.6 2.0 2.0 2.0 2.0 2.0
010750024.WAV,S AE N D IY L AH V Z JH AA,2.0 1.8 2.0 2.0 2.0 2.0 2.0 2.0 2.0 2.0 2.0
010750026.WAV,L EY L AA L AH V Z JH AH P AE N,2.0 1.6 2.0 2.0 2.0 2.0 2.0 2.0 2.0 2.0 2.0 2.0 2.0
010750035.WAV,IH T S T UW TH R IY W AH N,2.0 2.0 2.0 2.0 2.0 1.6 2.0 2.0 2.0 2.0 2.0
010750043.WAV,T UW Z IH ER OW W AH N S EH V N,2.0 2.0 1.8 2.0 2.0 2.0 2.0 2.0 2.0 2.0 2.0 2.0 2.0
010750060.WAV,B IH L IY L EH T S AH L IH T L T EH L,2.0 2.0 2.0 2.0 1.6 2.0 2.0 2.0 2.0 2.0 2.0 2.0 2.0 2.0 1.8 2.0
010750062.WAV,B EH N IY G OW T S S AH M P AO R K,1.8 1.6 2.0 2.0 2.0 1.2 1.2 1.2 2.0 2.0 2.0 2.0 1.8 2.0 2.0
010750072.WAV,L UH K AE T EH L Z N OW Z,2.0 2.0 2.0 2.0 1.6 2.0 1.8 1.6 2.0 0.8 1.6
010750094.WAV,L UH K AE T DH AE T T IY N AH S S AE N D L Z,2.0 2.0 2.0 2.0 1.6 2.0 2.0 1.6 2.0 2.0 2.0 2.0 2.0 2.0 2.0 2.0 2.0 2.0 1.6
010750097.WAV,M EH ER IH G AH T AH N DH AH T R EY N,2.0 2.0 2.0 2.0 2.0 2.0 2.0 2.0 2.0 2.0 2.0 2.0 2.0 2.0 2.0
010750099.WAV,AE N D K AE N S IY DH AH V AE N,2.0 2.0 2.0 2.0 2.0 2.0 2.0 2.0 2.0 2.0 1.8 2.0 2.0
010750102.WAV,S AE N D G AH T AH N DH AH K AA R,2.0 2.0 2.0 2.0 2.0 2.0 2.0 2.0 2.0 2.0 2.0 2.0 2.0 2.0
010750104.WAV,S AH M TH R IY W IH DH AH N T UW T IY CH ER S AH F IH S,1.8 2.0 2.0 1.6 1.6 2.0 2.0 2.0 1.8 2.0 2.0 2.0 1.8 2.0 2.0 2.0 2.0 2.0 2.0 2.0 2.0 2.0
010750117.WAV,HH AH N IY K AH M S IY DH AH G AA R D N,2.0 2.0 2.0 2.0 2.0 2.0 2.0 2.0 2.0 2.0 2.0 2.0 2.0 2.0 2.0 2.0
010750163.WAV,N AW Y UW HH AE V IH T,1.8 1.2 2.0 1.8 2.0 2.0 2.0 2.0 2.0
010750168.WAV,HH AW AY TH AE NG K Y UW,2.0 2.0 2.0 1.2 2.0 2.0 2.0 2.0 2.0
010760001.WAV,L IH N D AH L AY K S AH R IH N JH,2.0 2.0 2.0 2.0 2.0 2.0 2.0 2.0 2.0 1.8 2.0 2.0 2.0 2.0
010760002.WAV,M AE R IH DH AH N P OY N T DH AH K AW,2.0 2.0 2.0 2.0 2.0 1.6 2.0 2.0 1.6 1.0 0.8 2.0 2.0 2.0 1.2
010760013.WAV,T IY M IY K AE N D R AO DH AH D AH K,2.0 2.0 2.0 2.0 2.0 2.0 2.0 2.0 2.0 1.8 1.8 2.0 2.0 2.0 1.6
010760032.WAV,Z IH ER OW N AY N S EH V N EY T,2.0 1.6 1.6 1.4 2.0 2.0 1.6 2.0 2.0 1.8 2.0 2.0 1.2
010760038.WAV,N AY N N AY N EY T TH R IY,2.0 2.0 1.6 2.0 2.0 1.6 2.0 1.4 1.6 2.0 2.0
010760046.WAV,Z IH ER OW Z IH ER OW F AO TH R IY T UW,2.0 1.6 1.6 1.4 2.0 1.2 1.2 1.0 2.0 2.0 1.8 2.0 2.0 2.0 1.8
010760060.WAV,D AH Z JH UW N L AY K DH AH N UW D L Z,2.0 2.0 1.8 2.0 2.0 1.4 2.0 2.0 2.0 2.0 2.0 2.0 2.0 2.0 2.0 1.6
010760062.WAV,L AH K IH NG L AY K F IH SH,2.0 1.8 2.0 2.0 2.0 1.8 2.0 1.6 2.0 2.0 1.8
010760067.WAV,L EY L AA AE T AH L IH T L M AH T N,2.0 1.8 2.0 2.0 2.0 2.0 2.0 2.0 2.0 2.0 2.0 2.0 1.2 2.0 2.0
010760076.WAV,L EH T S D R AO L IH L IY S HH AE N D,2.0 2.0 1.6 1.6 0.8 0.8 1.6 2.0 2.0 2.0 2.0 2.0 2.0 2.0 2.0 2.0
010760079.WAV,L EH S D R AO JH EY M IY Z M AW TH,2.0 2.0 2.0 2.0 2.0 1.6 2.0 1.6 2.0 2.0 1.6 2.0 1.4 1.6
010760089.WAV,R EH R L IY G AH T DH AH SH ER T,1.8 1.6 1.6 2.0 2.0 2.0 0.2 2.0 1.6 2.0 2.0 0.6 2.0
010760097.WAV,AH L IY S AH IH Z K L IY N IH NG DH AH K AA,0.8 2.0 2.0 2.0 1.8 2.0 2.0 2.0 2.0 2.0 1.2 1.6 1.6 2.0 2.0 2.0 2.0
010760108.WAV,S OW L EY L AA W EH N T IH N T UW DH AH P OW S T AH F IH S,1.6 2.0 2.0 1.6 2.0 2.0 2.0 2.0 2.0 2.0 2.0 2.0 2.0 1.6 2.0 2.0 2.0 2.0 0.4 1.8 0.6 2.0 2.0 2.0
010760111.WAV,B EH T IY K AE N S IY DH AH M Y UW Z IH K R UH M,2.0 1.2 0.4 1.2 2.0 1.8 2.0 2.0 1.6 1.8 2.0 2.0 2.0 1.8 0.6 1.2 1.8 2.0 2.0 2.0
010760116.WAV,M AE N D IY W AH T S W AO K IH NG T UW N EY CH AH K AA D,2.0 2.0 2.0 2.0 2.0 2.0 1.8 2.0 2.0 2.0 1.4 2.0 2.0 2.0 2.0 1.6 2.0 2.0 1.6 0.6 2.0 2.0 2.0
010760136.WAV,N EH V AH M AY N D DH AH P EH N,2.0 2.0 0.0 0.8 1.6 1.0 1.6 1.0 1.6 2.0 2.0 2.0 2.0
010760151.WAV,AY D UW T UW S K UW L,2.0 2.0 1.8 2.0 1.8 2.0 2.0 2.0 1.8
010760162.WAV,HH AW HH AE P IY EY EH M,2.0 1.8 2.0 2.0 2.0 2.0 0.8 2.0 1.8
010760169.WAV,IH Z IH T DH AH G ER L,2.0 1.8 2.0 2.0 1.8 2.0 2.0 1.4 1.2
010920012.WAV,L IH L IY K AE N S IY DH AH P AE N D AH,1.6 2.0 1.8 1.8 2.0 2.0 2.0 2.0 2.0 1.8 2.0 2.0 2.0 2.0 2.0 2.0
010920024.WAV,M AE N D IY L IH V IH N B R IH T N,2.0 2.0 1.6 2.0 2.0 2.0 2.0 2.0 2.0 2.0 2.0 2.0 0.4 2.0 2.0
010920025.WAV,T IH M IH Z AH F R EH N D F R AH M JH ER M AH N,2.0 2.0 2.0 2.0 2.0 2.0 1.6 1.4 1.2 1.2 0.8 1.6 1.6 1.6 1.6 2.0 0.8 1.6 2.0 2.0
010920030.WAV,EY T F AY V TH R IY T UW,2.0 2.0 2.0 2.0 2.0 1.6 2.0 2.0 2.0 2.0
010920032.WAV,F AY V N AY N S EH V N S EH V N,2.0 2.0 2.0 2.0 2.0 1.6 2.0 2.0 2.0 2.0 2.0 2.0 2.0 2.0
010920033.WAV,W AH N F AY V F AO EY T,2.0 2.0 2.0 2.0 2.0 1.2 2.0 2.0 2.0 2.0
010920043.WAV,F AO TH R IY S EH V N Z IH ER OW,2.0 2.0 1.8 2.0 2.0 2.0 2.0 2.0 2.0 1.8 1.8 1.4 1.4
010920044.WAV,F AO N AY N W AH N TH R IY,2.0 1.8 2.0 2.0 2.0 2.0 2.0 2.0 1.6 2.0 2.0
010920065.WAV,JH EY M IY S M EH L Z F R EH SH F IH SH,2.0 2.0 2.0 2.0 2.0 2.0 2.0 2.0 1.8 2.0 2.0 2.0 1.0 2.0 2.0 1.8
010920070.WAV,JH AE K S M EH L Z F R EH SH CH IH K IH N,1.6 1.6 1.6 2.0 2.0 2.0 2.0 1.8 2.0 2.0 2.0 1.6 2.0 2.0 2.0 2.0 2.0
010920075.WAV,T IY N AH HH AE Z AH B IH G T IY,2.0 2.0 2.0 1.8 2.0 2.0 2.0 2.0 1.0 2.0 2.0 2.0 2.0
010920101.WAV,L EY L AA K AE N S IY DH AH V AE N,2.0 2.0 2.0 2.0 2.0 2.0 2.0 2.0 2.0 2.0 2.0 1.8 1.2 1.0
010920105.WAV,DH EH N JH AE K W AO K T T UW HH AH S P IH T L,1.8 2.0 2.0 2.0 1.6 2.0 2.0 2.0 2.0 2.0 2.0 2.0 2.0 2.0 1.8 2.0 1.8 2.0 2.0
010920125.WAV,HH EH N IY W UH D Y UW L AY K T UW G R OW K AE R AH T,2.0 0.4 2.0 2.0 2.0 2.0 2.0 2.0 1.8 2.0 2.0 2.0 2.0 2.0 1.6 1.2 0.0 2.0 2.0 2.0 2.0 2.0
010920126.WAV,M AE R IH W UH D Y UW L AY K T UW G R EY L IY K,2.0 2.0 2.0 2.0 2.0 2.0 2.0 2.0 1.8 2.0 2.0 2.0 2.0 2.0 2.0 2.0 1.8 2.0 1.8 2.0
010920138.WAV,L IH N D AH W AA SH T DH AH CH AY N IY Z K AE B IH JH,1.6 0.2 0.6 1.6 1.4 2.0 1.0 0.8 2.0 2.0 2.0 2.0 2.0 2.0 2.0 1.6 2.0 2.0 2.0 2.0 2.0
010920141.WAV,M AE R IH IH Z N AH T AH R IH AH L IY AE K T ER,2.0 2.0 2.0 2.0 2.0 1.8 2.0 2.0 2.0 2.0 1.8 1.8 1.8 2.0 2.0 0.8 2.0 2.0 2.0
010920153.WAV,EY EH M AY Y UH AH B ER D,0.8 2.0 1.8 1.8 2.0 1.8 1.8 2.0 2.0 2.0
010920159.WAV,M AY M AH DH ER IH Z IH N AH R EH D D R EH S,2.0 2.0 2.0 2.0 1.8 2.0 2.0 2.0 2.0 2.0 2.0 2.0 2.0 1.4 2.0 2.0 2.0 2.0
010920165.WAV,AY K AE N D UH IH T,2.0 2.0 2.0 2.0 2.0 1.8 2.0 2.0
010990020.WAV,W EH L AY K AE N AH SH UH AH Y UW IH T IH Z N AH T,2.0 1.6 1.6 2.0 2.0 2.0 2.0 2.0 2.0 2.0 2.0 2.0 2.0 2.0 2.0 2.0 1.8 2.0 2.0 2.0
010990048.WAV,AY W AH Z DH IY OW N L IY W AH N HH UW K UH D D UH DH AE T,2.0 2.0 2.0 2.0 2.0 2.0 2.0 2.0 2.0 2.0 2.0 2.0 2.0 2.0 2.0 2.0 2.0 1.8 2.0 1.8 2.0 2.0 2.0
010990060.WAV,W EH N Z D EY W AH Z W AH N AH V DH OW Z T AY M Z,2.0 2.0 2.0 2.0 2.0 2.0 2.0 2.0 1.8 2.0 2.0 2.0 2.0 2.0 2.0 2.0 1.8 2.0 2.0 2.0 1.8
010990063.WAV,B AH T W IY HH AE D T AH P R UW V AW AH S EH L V Z T AH DH AH M,2.0 2.0 1.8 2.0 2.0 2.0 2.0 2.0 2.0 2.0 2.0 2.0 2.0 2.0 2.0 2.0 2.0 2.0 2.0 1.8 1.8 2.0 2.0 1.6 1.6 1.6
010990082.WAV,W AH N P ER S N W AH Z K IH L D AE N D T UW AH DH AH Z W UW N D IH D,2.0 2.0 2.0 2.0 2.0 2.0 2.0 2.0 2.0 1.8 2.0 2.0 2.0 2.0 2.0 2.0 2.0 2.0 2.0 2.0 2.0 2.0 1.6 2.0 1.0 2.0 2.0 2.0 1.8
010990087.WAV,DH EY AO T T UW T EY K AH L IH T L AH V DH IH S K R IH S M AH S S P IH AH IH T,2.0 2.0 2.0 1.8 2.0 2.0 2.0 2.0 2.0 2.0 2.0 2.0 2.0 1.6 1.8 2.0 2.0 2.0 2.0 2.0 2.0 2.0 2.0 2.0 2.0 2.0 2.0 2.0 2.0 2.0 2.0 2.0
010990123.WAV,T AY M T UW G OW T UW DH AH G EY M,2.0 2.0 2.0 2.0 2.0 2.0 2.0 2.0 2.0 2.0 2.0 2.0 2.0 1.8
010990139.WAV,S T IH L N AH T SH UH AH W AH T IH T W AH Z,2.0 2.0 2.0 1.6 2.0 2.0 2.0 2.0 2.0 2.0 2.0 2.0 2.0 2.0 2.0 2.0 2.0 1.8
010990162.WAV,N IY D T UW P IH K AH P M AO R AH V DH IH S,2.0 1.8 1.8 2.0 2.0 2.0 2.0 2.0 2.0 2.0 2.0 2.0 2.0 2.0 2.0 2.0 2.0 2.0
010990165.WAV,W EH L W AH N AH V M AY TH IH NG Z,2.0 2.0 2.0 2.0 1.8 2.0 1.6 1.0 2.0 2.0 2.0 2.0 2.0 1.6
010990188.WAV,DH IY Z K IH D Z N IY D AO L DH AH HH EH L P DH EY K AE N G EH T,1.8 2.0 1.8 2.0 2.0 1.8 1.8 2.0 1.8 2.0 2.0 2.0 2.0 2.0 2.0 2.0 1.6 2.0 1.8 2.0 2.0 2.0 2.0 2.0 2.0 2.0
010990202.WAV,HH OW P AY G EH T T UW S IY Y UW T UW,2.0 2.0 2.0 2.0 2.0 2.0 2.0 2.0 2.0 2.0 2.0 2.0 1.8 2.0 2.0
010990218.WAV,CH EY N JH IH Z P AA R T AH V G R OW IH NG,2.0 2.0 2.0 2.0 2.0 1.8 2.0 2.0 2.0 2.0 2.0 1.8 2.0 2.0 2.0 2.0 2.0
010990239.WAV,N OW Y UW AA V EH R IY K R IY EY T IH V,2.0 2.0 2.0 2.0 1.6 1.8 2.0 2.0 2.0 2.0 2.0 2.0 2.0 2.0 2.0 2.0
010990260.WAV,AY W UH D L AH V T AH G OW T AH DH AE T T R AE K,2.0 2.0 2.0 2.0 2.0 2.0 2.0 2.0 1.8 2.0 2.0 2.0 1.8 2.0 2.0 1.8 2.0 2.0 1.8 2.0
010990267.WAV,IH T S S IH NG G L AH V DH AH W IY K N EH K S T W IY K,2.0 2.0 2.0 2.0 2.0 2.0 2.0 2.0 2.0 2.0 2.0 2.0 2.0 2.0 1.6 2.0 2.0 2.0 2.0 2.0 2.0 2.0 1.6
010990276.WAV,W IY W IH L B IY W AH N AH V DH EH M,2.0 2.0 2.0 2.0 2.0 2.0 2.0 2.0 2.0 2.0 2.0 2.0 2.0 1.6 2.0
010990279.WAV,W IY W IH L S IY Y UW T AH M AH R OW AE T DH AH S T R IY M,2.0 2.0 2.0 2.0 1.6 2.0 2.0 2.0 1.8 2.0 2.0 2.0 2.0 2.0 2.0 2.0 2.0 1.4 1.6 2.0 2.0 2.0 2.0 2.0
010990291.WAV,SH IY T EH L IH T L AY K IH T IH Z,2.0 2.0 2.0 2.0 2.0 2.0 2.0 2.0 2.0 2.0 2.0 2.0 2.0 1.8
010990313.WAV,Y EH S HH IY HH AE D N OW N IH T,2.0 2.0 2.0 2.0 2.0 2.0 2.0 1.6 2.0 0.8 2.0 2.0 2.0
011090011.WAV,IH T W AH Z AE N IH M P AO T N T W IH N,1.6 2.0 2.0 2.0 1.8 2.0 2.0 2.0 1.8 2.0 2.0 2.0 2.0 1.8 2.0 1.6 2.0
011090020.WAV,DH EH R Z AH W EY T UW HH EH L P AW AH P R AH T EH K SH N,2.0 1.6 1.6 2.0 2.0 2.0 1.2 2.0 1.8 2.0 2.0 2.0 2.0 2.0 2.0 2.0 2.0 2.0 2.0 2.0 2.0 2.0 2.0
011090034.WAV,AY N OW HH AW DH EY L UH K,2.0 2.0 1.2 2.0 2.0 2.0 1.8 2.0 2.0 2.0
011090089.WAV,D R IH NG K AH L AH T AH V W AO T AH,2.0 2.0 2.0 2.0 2.0 2.0 2.0 2.0 2.0 2.0 2.0 2.0 1.4 2.0 1.6
011090140.WAV,Y UW M EY D M IY B IH L IY V W IY K AE N AO L M EY K AH D IH F R AH N S,2.0 1.8 2.0 2.0 2.0 2.0 2.0 2.0 1.6 2.0 2.0 1.6 2.0 1.8 2.0 2.0 2.0 2.0 2.0 2.0 1.2 2.0 2.0 2.0 2.0 2.0 2.0 1.8 2.0 2.0
011090154.WAV,S IH AH R IH AH S L IY DH IH S IH Z G EH T IH NG AW T AH V K AH N T R OW L,2.0 2.0 2.0 2.0 2.0 2.0 2.0 2.0 2.0 2.0 2.0 2.0 2.0 2.0 2.0 2.0 2.0 2.0 2.0 2.0 2.0 2.0 1.6 2.0 1.2 1.6 2.0 2.0 1.6 1.6
011090184.WAV,AY D UH N AH T L AH V DH IH S W IH N D,2.0 2.0 1.6 2.0 2.0 2.0 2.0 2.0 1.6 2.0 2.0 2.0 2.0 2.0 2.0 1.4
011090220.WAV,AO L HH IY W AH N T IH D T UW D UH W AH Z W IH N,2.0 2.0 2.0 2.0 2.0 1.8 2.0 2.0 2.0 2.0 2.0 1.6 2.0 1.6 2.0 1.8 1.8 2.0 2.0 1.8
011090235.WAV,S IY IH NG AH L AH T AH V B AE K AE N D G UH D,2.0 2.0 2.0 2.0 2.0 2.0 2.0 2.0 2.0 1.8 2.0 1.6 2.0 2.0 2.0 2.0 2.0 2.0 2.0
011090246.WAV,Y EH S TH AE NG K Y UW F AO R IH M AY N D IH NG M IY,2.0 2.0 2.0 2.0 2.0 2.0 2.0 2.0 2.0 2.0 2.0 2.0 2.0 1.6 1.6 1.6 2.0 1.6 1.6 2.0 2.0
011090273.WAV,L AH V HH IH M S OW M AH CH F AO DH AE T,2.0 2.0 1.8 2.0 2.0 2.0 2.0 2.0 2.0 2.0 1.8 2.0 2.0 2.0 2.0 2.0
011090277.WAV,W EH N IH Z DH AE T G OW IH NG T UW B IY F IH K S T,2.0 1.8 2.0 2.0 1.8 2.0 2.0 2.0 2.0 1.8 2.0 2.0 2.0 1.8 2.0 1.8 2.0 2.0 2.0 2.0 2.0
011090292.WAV,W IY HH AE V T UW B IY P EY SH N T AE Z M AH CH AE Z IH T S AH K S,2.0 2.0 2.0 2.0 2.0 2.0 2.0 2.0 1.8 2.0 1.8 2.0 2.0 1.6 2.0 1.8 2.0 2.0 2.0 2.0 1.6 2.0 2.0 2.0 2.0 2.0 2.0
011090295.WAV,B IH K AH Z DH AE T S AO L Y UW HH AE V T UW AH F AH,2.0 2.0 2.0 2.0 1.8 2.0 2.0 2.0 2.0 2.0 2.0 2.0 2.0 2.0 2.0 2.0 2.0 2.0 2.0 1.8 1.8
011090320.WAV,SH IY P UH T HH AH AA M Z AH R AW N D HH IH M AE N D W AA N T IH D K IH S HH IH M,1.6 1.8 2.0 2.0 2.0 2.0 2.0 2.0 1.8 1.6 2.0 2.0 2.0 2.0 2.0 2.0 2.0 1.8 2.0 2.0 2.0 2.0 1.8 2.0 2.0 1.8 2.0 2.0 2.0 2.0 2.0 2.0 2.0
011090329.WAV,AY AA S K T HH AH N AH T T UW,2.0 2.0 2.0 2.0 2.0 2.0 2.0 2.0 2.0 2.0 2.0 1.6
011090333.WAV,B IH F AO AO L EH L S Y UW W IH L AA N S AH M IY AH K W EH S CH AH N,2.0 2.0 2.0 2.0 2.0 2.0 2.0 2.0 2.0 2.0 2.0 2.0 2.0 2.0 2.0 2.0 2.0 2.0 2.0 2.0 2.0 2.0 2.0 2.0 2.0 2.0 2.0 2.0
011090334.WAV,HH AW K AE N DH EY S T IH L B IH L IY V IH N S AH M TH IH NG L AY K DH AE T,2.0 2.0 2.0 2.0 2.0 1.8 1.6 2.0 2.0 2.0 2.0 2.0 2.0 2.0 2.0 1.6 2.0 2.0 2.0 2.0 2.0 1.6 2.0 2.0 2.0 2.0 2.0 1.8 2.0 2.0
011090335.WAV,HH IY HH AE D N OW K L IH AH AY D IH AH AE T AO L,2.0 2.0 2.0 2.0 2.0 2.0 2.0 2.0 2.0 2.0 2.0 2.0 2.0 2.0 2.0 2.0 2.0 2.0 2.0
011090359.WAV,HH IY IH Z B EH T AH AH F N AW DH AE N B IH F AO HH AE V IH NG AH S AO,2.0 2.0 2.0 1.8 2.0 2.0 2.0 2.0 2.0 2.0 2.0 2.0 2.0 2.0 2.0 2.0 2.0 2.0 2.0 2.0 1.6 2.0 2.0 2.0 2.0 2.0 2.0
011350001.WAV,AE N D DH AE T W AH Z DH AH K IY T UW HH IH Z S AH K S EH S,2.0 2.0 2.0 2.0 2.0 2.0 2.0 1.6 2.0 2.0 2.0 2.0 2.0 2.0 2.0 2.0 2.0 1.4 2.0 2.0 2.0 2.0 2.0 2.0
011350026.WAV,B AH T AY S IY N OW K AO Z F AO K AH N S ER N AO AH L AA M,2.0 2.0 2.0 2.0 2.0 2.0 2.0 2.0 2.0 2.0 1.4 2.0 2.0 2.0 1.6 1.2 1.6 1.6 1.6 2.0 2.0 2.0 2.0 1.6
011350027.WAV,S T AA R T IH NG AH N T Y UW Z D EY IH T S B AE K T UW W ER K,2.0 2.0 2.0 2.0 2.0 2.0 2.0 2.0 1.6 2.0 2.0 1.6 0.4 2.0 2.0 2.0 2.0 2.0 2.0 2.0 2.0 2.0 2.0 2.0 2.0 2.0
011350064.WAV,IH N K AH L IH JH Y UW K UH D G EH T AH W EY W IH DH TH IH NG Z,2.0 2.0 2.0 2.0 0.0 1.2 1.6 2.0 2.0 2.0 2.0 2.0 2.0 2.0 2.0 2.0 1.8 2.0 2.0 2.0 2.0 2.0 2.0 2.0 1.8
011350116.WAV,L UH K IH NG T UW G EH T IH N T AH CH W IH DH Y AO M AA K IH T IH NG K R UW,2.0 2.0 2.0 2.0 2.0 2.0 2.0 2.0 2.0 2.0 2.0 2.0 2.0 2.0 0.6 2.0 2.0 1.8 2.0 2.0 2.0 2.0 2.0 2.0 2.0 2.0 2.0 2.0 2.0 1.4
011350141.WAV,T EY K AH B R EY K T UW G EH T AH G L AA S AH V W AO T ER L EY T L IY,2.0 2.0 2.0 2.0 2.0 2.0 2.0 2.0 2.0 2.0 2.0 2.0 2.0 2.0 2.0 2.0 2.0 2.0 2.0 1.4 2.0 1.8 2.0 2.0 2.0 2.0 2.0 2.0 2.0
011350158.WAV,N AW IH Z DH AH N Y UW L EY T ER,2.0 2.0 2.0 2.0 1.6 2.0 2.0 2.0 2.0 2.0 2.0 2.0 2.0
011350173.WAV,Y EH T DH EY EH N D AH P IH N S EH L Z,2.0 2.0 2.0 2.0 2.0 1.6 2.0 2.0 2.0 2.0 2.0 2.0 2.0 2.0 2.0 1.8
011350190.WAV,W AH T D UH Y UW TH IH NG K AH V B AH D L AY T S N Y UW D IH Z AY N,2.0 2.0 2.0 2.0 1.8 2.0 2.0 2.0 2.0 2.0 2.0 2.0 1.6 2.0 2.0 2.0 2.0 2.0 2.0 2.0 2.0 2.0 2.0 2.0 2.0 2.0 2.0 2.0
011350215.WAV,S P IH AH IH T IH D AH W EY IH Z AH M AA S T AH P IY S,2.0 1.4 0.8 0.8 1.6 2.0 2.0 2.0 2.0 2.0 2.0 2.0 2.0 2.0 2.0 2.0 1.6 2.0 2.0 1.8 2.0 2.0
011350218.WAV,G EH T R EH D IY T UW M EY K F AH N AH V DH AH M,2.0 2.0 2.0 2.0 2.0 2.0 2.0 2.0 1.8 2.0 2.0 2.0 2.0 2.0 1.0 1.6 1.4 1.4 2.0 2.0
011350221.WAV,N OW K IH D IH NG N AH T IY V N AH L IH T L,2.0 2.0 2.0 2.0 2.0 2.0 1.8 2.0 2.0 2.0 2.0 2.0 2.0 2.0 2.0 2.0 2.0 2.0
011350225.WAV,DH AE T S DH AH OW N L IY TH IH NG HH IY K AE N D UH AE T DH AH P OY N T,2.0 2.0 2.0 2.0 2.0 2.0 1.6 0.8 2.0 2.0 2.0 2.0 1.8 2.0 2.0 2.0 2.0 2.0 2.0 1.6 2.0 2.0 2.0 2.0 2.0 1.2 1.6 1.6
011350249.WAV,DH EY W ER S OW IH N L AH V W IH DH IY CH AH DH ER,2.0 2.0 2.0 2.0 2.0 2.0 2.0 2.0 2.0 2.0 1.8 2.0 2.0 1.6 2.0 1.2 2.0 2.0 2.0
011350257.WAV,W IH L B IY F AH N T UW DH AE T S DH AH M AO L Y IH AH,2.0 2.0 2.0 2.0 2.0 2.0 2.0 2.0 2.0 1.8 0.4 0.4 2.0 2.0 2.0 2.0 2.0 2.0 2.0 2.0 2.0 2.0
011350290.WAV,F AO L IH N L AH V W IH DH Y AO OW N AH K AH M P AH N IY,2.0 2.0 2.0 2.0 2.0 2.0 2.0 1.8 2.0 2.0 0.8 2.0 2.0 2.0 2.0 2.0 2.0 1.2 2.0 2.0 2.0 2.0 2.0
011350303.WAV,S AH P AO T IH NG IY CH AH DH ER IH Z DH AH K IY,2.0 1.2 2.0 2.0 2.0 2.0 0.8 2.0 1.6 2.0 1.8 2.0 2.0 2.0 2.0 2.0 1.8 1.8
011350318.WAV,IH T W AH Z OW N L IY AH N OW T AH F Y UW L AY N Z,2.0 2.0 2.0 1.8 1.8 1.6 1.2 2.0 2.0 2.0 2.0 2.0 2.0 2.0 2.0 1.6 2.0 2.0 1.6 0.2 1.6
011350345.WAV,B EH S T T UW S EY N AH TH IH NG AH N T IH L DH AH IH N T AY AH AH F EH R W AH Z OW V ER,2.0 2.0 1.6 2.0 2.0 1.6 2.0 1.2 2.0 2.0 1.8 2.0 1.8 2.0 1.6 2.0 2.0 2.0 2.0 2.0 1.6 0.8 1.6 1.4 1.4 2.0 2.0 2.0 2.0 2.0 1.8 2.0 1.8 2.0 2.0
011350374.WAV,W AH T W ER DH AH P AH L IY S AH B AW T,2.0 2.0 2.0 2.0 1.8 2.0 2.0 2.0 2.0 2.0 2.0 2.0 2.0 2.0 2.0 2.0
011560005.WAV,AY HH AE D T UW D UH IH T F R AH M AH F AY N AE N SH L S T AE N D P OY N T,2.0 2.0 2.0 2.0 2.0 1.8 2.0 1.8 2.0 2.0 2.0 2.0 2.0 1.8 2.0 2.0 2.0 2.0 2.0 2.0 2.0 1.6 2.0 2.0 2.0 2.0 2.0 2.0 2.0 2.0 2.0
011560058.WAV,IH T IH Z D EY N JH ER AH S T UW G OW T UW AH D AA K T ER,2.0 2.0 2.0 2.0 2.0 2.0 2.0 2.0 2.0 2.0 2.0 2.0 2.0 2.0 2.0 2.0 2.0 2.0 2.0 1.6 2.0 2.0 2.0
011560063.WAV,DH IH S L UH K S AE Z IH F IH T S G OW IH NG T UW W ER K,1.8 2.0 2.0 2.0 2.0 2.0 2.0 2.0 1.8 2.0 2.0 2.0 2.0 2.0 2.0 2.0 2.0 2.0 2.0 1.8 2.0 2.0 2.0
011560068.WAV,B AH T IH F DH EY K OW AH P ER EY T DH EY M EY B EH N IH F IH T F R AH M DH AH S IH CH UW EY SH N,2.0 2.0 2.0 2.0 2.0 2.0 2.0 2.0 1.8 1.6 2.0 2.0 2.0 2.0 2.0 2.0 2.0 2.0 2.0 2.0 2.0 2.0 2.0 2.0 2.0 2.0 2.0 2.0 2.0 2.0 2.0 2.0 2.0 2.0 2.0 2.0 2.0 2.0
011560072.WAV,M AE N W AH Z M EY D T UW W AO K,2.0 1.8 2.0 2.0 2.0 1.8 2.0 2.0 2.0 2.0 1.8 2.0 1.6 2.0
011560075.WAV,Y UW W UH D HH AE V T UW L IH V IH T T UW B IH L IY V IH T,2.0 1.8 2.0 2.0 2.0 2.0 2.0 2.0 2.0 1.8 2.0 2.0 2.0 2.0 2.0 2.0 1.8 2.0 2.0 2.0 2.0 2.0 2.0 2.0
011560086.WAV,B AH T DH IH S IH Z N AH T DH AH T AY M T UW CH EY N JH K AH L ER Z,2.0 2.0 2.0 2.0 2.0 2.0 2.0 1.8 2.0 2.0 2.0 1.8 2.0 2.0 2.0 2.0 2.0 1.8 2.0 2.0 2.0 1.8 2.0 2.0 2.0 2.0 1.6
011560100.WAV,SH IY W AH Z P L EY S T HH ER AH N D ER HH AW S AH R EH S T DH AH N EH K S T D EY,2.0 1.8 2.0 2.0 1.8 2.0 2.0 2.0 2.0 2.0 2.0 2.0 1.6 1.6 2.0 2.0 2.0 2.0 2.0 2.0 2.0 2.0 2.0 2.0 2.0 2.0 2.0 2.0 2.0 2.0 2.0 2.0 2.0
011560117.WAV,DH AH L EY T IH S T AH D IH SH N T UW DH AH K AH L EH K SH N,2.0 2.0 2.0 2.0 2.0 2.0 2.0 2.0 2.0 2.0 2.0 2.0 2.0 2.0 1.8 2.0 2.0 2.0 2.0 2.0 2.0 2.0 2.0 2.0
011560184.WAV,TH AE NG K S F AO T EY K IH NG DH AH T AY M T UW D UH DH AH S T AO R IY,2.0 2.0 2.0 2.0 2.0 2.0 2.0 2.0 2.0 2.0 2.0 2.0 2.0 2.0 2.0 2.0 2.0 2.0 2.0 2.0 1.8 2.0 2.0 2.0 2.0 2.0 2.0 2.0
011560192.WAV,IH T S G OW IH NG T UW B IY S AH CH AH K R EY Z IY M OW M AH N T,2.0 2.0 2.0 2.0 2.0 2.0 2.0 2.0 2.0 2.0 2.0 2.0 2.0 2.0 2.0 2.0 2.0 2.0 2.0 2.0 2.0 2.0 2.0 2.0 2.0 2.0
011560202.WAV,P OW UH AH T R IY IH Z G UH D F AO DH AH S OW L,2.0 2.0 2.0 2.0 2.0 2.0 2.0 2.0 2.0 2.0 2.0 2.0 2.0 2.0 2.0 2.0 2.0 2.0 1.8
011560257.WAV,HH UW W AH N T T UW G OW T UW DH AH P AA R K W IH TH M IY,2.0 2.0 2.0 2.0 2.0 1.8 2.0 1.8 2.0 2.0 2.0 1.8 2.0 2.0 2.0 2.0 2.0 1.8 2.0 2.0 2.0 2.0 2.0
011560269.WAV,AY N IY D T UW D UH S AH M TH IH NG W IH TH M AY L AY F,2.0 2.0 2.0 2.0 2.0 1.8 2.0 1.6 2.0 2.0 2.0 2.0 2.0 2.0 2.0 2.0 2.0 2.0 2.0 2.0 2.0 2.0
011560275.WAV,T EY K IH NG AH W AO K T UW DH AH S T AO R,2.0 2.0 2.0 2.0 2.0 2.0 2.0 2.0 2.0 2.0 1.8 2.0 2.0 2.0 2.0 2.0 2.0
011560289.WAV,AO R IH Z IH T G OW IH NG T UW HH AE P AH N,2.0 2.0 2.0 2.0 2.0 2.0 2.0 2.0 2.0 2.0 2.0 2.0 2.0 2.0 2.0 2.0 2.0
011560320.WAV,DH EY W ER G OW IH NG T UW M IY T AE Z Y UW ZH UW AH L,2.0 2.0 2.0 2.0 2.0 2.0 2.0 2.0 2.0 2.0 2.0 2.0 2.0 2.0 2.0 2.0 2.0 1.6 2.0 2.0 2.0
011560353.WAV,HH IY S T EH ER D AE T DH AH B L AE K N AH S,2.0 2.0 2.0 2.0 1.6 2.0 2.0 2.0 2.0 1.8 2.0 2.0 2.0 2.0 2.0 2.0 2.0 2.0
011560354.WAV,AY W AH Z W IH TH S EY M AH G UH D D IY L AA F T AH W AH D Z,2.0 2.0 1.8 1.8 2.0 2.0 2.0 2.0 2.0 2.0 2.0 2.0 2.0 2.0 2.0 2.0 2.0 2.0 2.0 2.0 2.0 2.0 2.0 1.6 1.6
011560372.WAV,T UW S EY S AH CH AH TH IH NG,2.0 1.8 2.0 1.6 2.0 2.0 2.0 2.0 2.0 2.0 2.0
011810063.WAV,SH IY K UH D JH AH S T G OW AH N AH N D AH N,2.0 2.0 2.0 2.0 2.0 2.0 2.0 2.0 2.0 2.0 2.0 1.8 2.0 1.4 1.8 2.0 1.8 2.0
011810067.WAV,IH F AY D UH DH AE T AY N OW W IH L M EY K DH AH T R IH K,2.0 2.0 2.0 2.0 2.0 2.0 2.0 1.8 2.0 2.0 2.0 2.0 2.0 2.0 2.0 2.0 2.0 0.4 0.4 1.2 1.2 2.0 2.0
011810133.WAV,AY N IY D T UW P IH K AH P AH D EH S K,2.0 1.6 1.4 1.6 2.0 1.8 2.0 2.0 2.0 2.0 2.0 2.0 2.0 1.2 2.0 2.0
011810162.WAV,P L EH ER Z G EH T AH P AA T AH N DH AH B AE K R AY T,2.0 2.0 1.2 1.2 2.0 2.0 2.0 2.0 2.0 2.0 2.0 2.0 2.0 2.0 2.0 2.0 2.0 2.0 2.0 0.8 1.6 1.6
011810168.WAV,B IH K AO Z Y UW N IY D AH SH EH L F,2.0 2.0 2.0 2.0 1.8 2.0 2.0 2.0 1.8 2.0 2.0 1.6 1.6 1.6 0.8
011810173.WAV,P L IY Z N OW DH AE T W IY AA W ER K IH NG T UW R IH M UW V IH F,2.0 2.0 2.0 1.8 2.0 1.8 2.0 2.0 2.0 2.0 2.0 2.0 2.0 2.0 2.0 2.0 2.0 2.0 2.0 2.0 2.0 2.0 1.2 0.8 2.0 2.0
011810184.WAV,DH EH R IH Z S T AE T T AY M F AO Y UW T UW JH OY N AH S T UW,1.6 1.6 1.6 2.0 1.8 1.6 1.6 1.0 1.6 1.2 0.4 0.8 2.0 2.0 2.0 2.0 2.0 2.0 1.6 2.0 1.6 2.0 2.0 2.0 2.0
011810197.WAV,S P IY K AH P F AO DH OW Z HH UW K AE N AH T S P IY K F AO DH AH M S EH L V Z,2.0 1.0 2.0 2.0 2.0 2.0 0.6 1.8 1.6 2.0 1.8 2.0 2.0 2.0 2.0 2.0 2.0 2.0 2.0 1.2 2.0 2.0 0.4 1.6 1.8 2.0 2.0 2.0 2.0 2.0 1.6 1.6
011810206.WAV,B L EH S IH NG AH N AH N Y UW Y ER,1.6 2.0 2.0 2.0 2.0 2.0 2.0 2.0 2.0 2.0 2.0 2.0 2.0 1.8
011810213.WAV,IY T IH NG R EY S W IH DH AH F AO K,1.2 2.0 2.0 2.0 2.0 2.0 2.0 2.0 2.0 2.0 2.0 1.6 1.6 1.2
011810214.WAV,AY G EH S DH IH S IH Z S AH P OW Z D T UW B IY F AH N,2.0 2.0 0.6 2.0 2.0 2.0 2.0 2.0 2.0 2.0 2.0 2.0 2.0 1.6 1.2 2.0 1.8 2.0 2.0 2.0 1.2 1.6
011810222.WAV,DH AE T S N AH T IY V N AH P R IH D IH K SH N,2.0 2.0 2.0 2.0 2.0 2.0 2.0 1.6 1.6 1.6 2.0 2.0 2.0 1.6 2.0 2.0 2.0 2.0 2.0
011810246.WAV,EY EH M AY DH AH OW N L IY W AH N HH IH AH,0.8 2.0 2.0 2.0 2.0 1.6 1.8 2.0 2.0 2.0 2.0 2.0 2.0 2.0 2.0 2.0
011810247.WAV,AY K AE N T EH L Y UW DH AH R IY Z N W AY,2.0 2.0 2.0 2.0 2.0 2.0 2.0 2.0 2.0 2.0 2.0 2.0 2.0 2.0 2.0 2.0 2.0
011810279.WAV,TH AE NG K S S OW M AH CH F AO DH AH F AH L OW Z,1.4 1.6 1.6 1.6 1.6 2.0 2.0 2.0 2.0 1.8 2.0 1.8 2.0 2.0 2.0 2.0 1.6 1.6 1.6
011810280.WAV,DH EY M IY W IH L B IY B AE K T AH G EH DH ER,1.6 1.6 2.0 2.0 2.0 2.0 1.6 2.0 2.0 2.0 2.0 2.0 2.0 2.0 2.0 2.0 2.0 1.8
011810284.WAV,L EH T M IY N OW IH F Y UW HH AE V EH N IY TH IH NG HH IY K AE N AH T EH N D,2.0 2.0 2.0 2.0 2.0 2.0 2.0 2.0 2.0 2.0 2.0 2.0 2.0 1.8 2.0 1.4 1.4 0.6 1.2 1.2 2.0 2.0 2.0 2.0 2.0 2.0 2.0 2.0 2.0 2.0
011810314.WAV,AH V DH IH S HH IY W UH D N AH T HH IH AH W UH D,2.0 2.0 2.0 2.0 2.0 2.0 1.8 2.0 2.0 2.0 2.0 2.0 2.0 2.0 2.0 2.0 2.0 2.0 0.8
011810334.WAV,HH IY M AH S T AH D M IH T DH AE T T UW HH IH M S EH L F,2.0 2.0 2.0 2.0 2.0 2.0 2.0 1.6 2.0 2.0 2.0 2.0 2.0 2.0 2.0 2.0 2.0 2.0 1.0 2.0 2.0 2.0 2.0
011810377.WAV,IH T S AH M AH CH W ER S DH AE N HH IY HH AE D IH K S P EH K T IH D,2.0 1.8 1.8 2.0 2.0 2.0 2.0 2.0 2.0 2.0 2.0 2.0 2.0 2.0 1.8 2.0 2.0 2.0 2.0 2.0 2.0 1.6 2.0 1.4 2.0 2.0 2.0
011860256.WAV,TH AE NG K F L F AO S OW M EH N IY AH V Y UW,0.4 1.6 2.0 2.0 1.6 1.6 2.0 2.0 2.0 2.0 2.0 2.0 2.0 2.0 2.0 2.0 2.0 1.8
011860263.WAV,R IH W AO R D L IH V Z IH N DH AH HH AW S AH V R IH S K,2.0 2.0 2.0 1.8 2.0 2.0 2.0 2.0 2.0 1.8 2.0 2.0 2.0 2.0 2.0 1.8 2.0 1.8 1.6 2.0 2.0 2.0 1.6
011860264.WAV,IH K S AY T IH D AE N D G OW IH NG T UW B EH D,2.0 2.0 2.0 2.0 2.0 1.6 2.0 2.0 1.8 1.8 2.0 2.0 2.0 2.0 2.0 1.8 2.0 1.6 2.0
011860284.WAV,DH AE T S S EY IH T IH Z G UH D,1.6 2.0 2.0 2.0 2.0 2.0 2.0 2.0 2.0 1.8 2.0 2.0 2.0
011860285.WAV,Y UW HH AE V T UW W ER K F AO DH EH M,2.0 2.0 2.0 2.0 2.0 1.2 1.8 2.0 1.6 1.6 2.0 2.0 1.8 1.4 2.0
011860287.WAV,N OW IH T IH Z Y UW HH UW M AH S T B IY TH AE NG K T,2.0 1.6 2.0 2.0 2.0 1.8 2.0 1.8 2.0 2.0 2.0 2.0 2.0 2.0 2.0 1.8 0.0 1.6 1.6 1.6 1.2
011860292.WAV,AO L DH AE T K AE N B IY V EH R IY K AH S T L IY,2.0 2.0 2.0 2.0 1.8 1.6 2.0 2.0 2.0 2.0 0.8 0.4 0.4 1.2 1.6 2.0 2.0 2.0 2.0 2.0
011860298.WAV,W EY K AH P W IH DH EY M IH SH N,2.0 2.0 2.0 2.0 2.0 2.0 2.0 1.8 1.6 2.0 2.0 0.8 1.2
011860301.WAV,D UH Y UW W AH N T G AH D T UW HH EH L P Y UW,2.0 1.8 2.0 2.0 2.0 2.0 2.0 2.0 2.0 1.6 1.6 2.0 2.0 2.0 2.0 1.6 2.0 2.0 2.0
011860308.WAV,AY W AH N T IH D T UW S IY DH AH M AE N AA F T AH HH IH AH R IH NG AO L DH IH S,2.0 2.0 2.0 2.0 2.0 2.0 1.6 1.6 2.0 2.0 2.0 2.0 2.0 2.0 1.8 2.0 2.0 2.0 1.6 2.0 2.0 1.8 1.8 1.4 2.0 2.0 2.0 2.0 1.6 2.0 2.0
011860317.WAV,IH T IY Z IY P R IH V EY L S IH S T AH M,2.0 2.0 2.0 2.0 2.0 2.0 2.0 1.8 2.0 1.2 1.4 2.0 2.0 2.0 1.6 1.2 1.6
011860332.WAV,AY T EH L Y UW IH T IH Z D EH TH,2.0 1.0 1.2 1.6 1.8 1.8 2.0 2.0 2.0 1.8 2.0 1.2 0.0
011860335.WAV,W AH T D UH Y UW S EY T UW EY M IH D L K AO S,1.0 2.0 2.0 2.0 2.0 2.0 2.0 2.0 1.8 1.6 1.6 1.4 2.0 2.0 1.6 1.2 0.8 1.4 2.0
011860346.WAV,Y UW AA AH F UW L F AO DH AE T,2.0 2.0 2.0 1.4 2.0 2.0 1.6 2.0 2.0 1.8 2.0 2.0
011860359.WAV,SH IY HH AE D HH IH AH OW N W IH L,2.0 2.0 2.0 2.0 2.0 2.0 2.0 2.0 1.4 1.4 2.0 2.0 1.6
011860361.WAV,AY W AH Z N EH V ER S IH K IH N M AY L AY F,2.0 2.0 2.0 2.0 2.0 1.2 1.6 1.6 2.0 2.0 1.8 2.0 2.0 2.0 2.0 2.0 2.0 1.8
